,id_post,id_parent_post,id_article,id_user,created_at,status,headline,body,positive_votes,negative_votes,label_argumentsused,label_discriminating,label_inappropriate,label_offtopic,label_personalstories,label_possiblyfeedback,label_sentimentnegative,label_sentimentneutral,label_sentimentpositive,is_staff,article_path,article_title,article_publishing_date,text,lang
3626,27821,27820.0,447,3112,2015-06-11 18:08:32.163,deleted,,"erstens ist die Zahl erfunden, und selbst wenn..., wenn deren kultureller Hintergrund der ""anatolische Islam"" gewesen wäre, dann wärs nix mit Gleichberechtigung zw. Mann und Frau, nix mit Life Ball, Conchita Wurst usw. ums mal so zu formulieren",5,1,0.0,1.0,0.0,0.0,0.0,0.0,1.0,0.0,0.0,0,Newsroom/Panorama/Gesellschaft/demografischerwandel,Österreichs Bevölkerung wuchs im Vorjahr um 77.000 Menschen,2015-06-11 13:01:46.000," Zuerst wird diese Zahl entdeckt, und... Obwohl ihr kultureller Hintergrund ""Anatolyan Islam"" ist, dann wird es nichts mit Gleichheit zwischen Mann und Frau geben, nichts mit Lifeball, Conchita verst, etc.",kn
4463,77217,77211.0,1178,28291,2015-09-07 20:45:29.993,online,"vor aölem nach den müllbergen am wochenende, die die gemeinde von den türken dann auf gemeindekosten entsorgen darf..",,2,0,0.0,1.0,0.0,0.0,0.0,0.0,1.0,0.0,0.0,0,daStandard/daAlltag,"""Verschmutzte Parks, laute Kinder, Ausländer""",2015-06-30 21:11:04.000,"Vor aölem nach Bergen von Müll über das Wochenende, kann die Gemeinde dann auf kommunale Kosten von den Türken entsorgen. ",kn
5075,148473,,1924,27712,2015-07-25 00:32:56.873,online,"Hallo Thomas,","ich mache Dich darauf aufmerksam, daß Du hier in Gutmenschen-Forum unterwegs bist! Hier gibt's keine Gnade!",1,8,0.0,1.0,1.0,1.0,0.0,0.0,1.0,0.0,0.0,0,Newsroom/Web/Netzpolitik/Hasspostings,Porsche entlässt Lehrling nach Hassposting auf Facebook,2015-07-24 11:09:44.000,"Hallo Thomas, ich möchte Sie darauf aufmerksam machen, dass Sie im Gutmenschen-Forum sind! Keine Gnade hier!",kn
5434,246926,246925.0,2928,5179,2015-08-27 17:08:08.170,online,,Hat der Fahrer von jedem vermuteten Flüchtling 10.000 Euro erhalten?,0,0,0.0,1.0,0.0,0.0,0.0,0.0,1.0,0.0,0.0,0,Meinung/Kommentare/FoederlSchmid,Die EU kann etwas gegen Schlepper tun,2015-08-27 16:02:49.000, Hat der Fahrer von jedem mutmaßlichen Flüchtling 10.000 Euro erhalten?,kn
5436,247490,,2943,19686,2015-08-28 13:15:37.740,online,"Wann gibts den ersten Politiker/die erste Politikerin,","die aus Prinzip nicht mehr mit der Krone spricht? Das ekelhafte Hetzblatt hat sich schon vollständig als »Nachrichtenmedium« disqualifiziert.

So was muss man nicht zu PKs einladen, sowas muss man keine Interviews geben. Und vor allem muss sich der journalistische Berufsstand sich bei der Nase nehmen und sicherstellen, dass jemand, der auch nur einen Tag dort gearbeitet hat, nie wieder bei einem anderen Medium Arbeit bekommt. Das sind keine KollegInnen!",16,3,0.0,1.0,1.0,0.0,0.0,0.0,1.0,0.0,0.0,0,Newsroom/Etat/PRINT/Mediaprint/krone,"""Krone""-Foto mit toten Flüchtlingen ""unentschuldbar""",2015-08-28 12:42:35.240,"Wann wird es in der Theologie den ersten Politiker geben, der mit der Krone spricht? Das ekelhafte Hassblatt hat sich bereits völlig als ""Nachrichtenmedium"" disqualifiziert.    Du musst dich nicht zu solchen PKs einladen, du musst keine Interviews wie diese geben. Und vor allem muss sich der Journalismusberuf selbst sehen und dafür sorgen, dass jemand, der eines Tages dort gearbeitet hat, nie wieder für ein anderes Medium arbeitet. Das sind keine Kollegen!",kn
5493,290992,290984.0,3398,24176,2015-09-10 21:57:03.907,online,,na ich hoffe der ungebremste zuzug von moslems bzw deren einbürgerung wird dann irgendwie erschwert oder gar gestoppt.,10,3,0.0,1.0,0.0,0.0,0.0,0.0,1.0,0.0,0.0,0,Newsroom/Panorama/Flucht/Flucht_und_Politik/europathema,Ungarn winkt Flüchtlinge nach Österreich durch – rund 7.500 am Donnerstag,2015-09-10 17:50:54.840," Nun, ich denke, dass der ungehinderte Zustrom von Muslimen oder ihre Einbürgerung irgendwie schwieriger oder gestoppt werden wird.",kn
5964,318890,318886.0,3650,7263,2015-09-21 00:13:53.707,online,"""Dürfen die Österreicher nicht auch irgendwann sagen dass sie genug haben?""","Wir sind schließlich noch bessere Menschen als es die Deutschen jemals sein werden. 

Darum müssen wir Österreicher pro-Kopf (bis Juni/Juli 2015 an der 3. Stelle pro-Kopf nach Schweden und Malta) auch mehr Flüchtlinge aufnehmen als die ohnehin schon guten Deutschen.

Wir müssen schließlich WILLKOMMENS-KULTUR-WELTMEISTER werden!

Hoffentlich kann unser herzlicher und für alle Flüchtlinge sich erbarmender Faymann bald - und für alle Ewigkeiten - den Willkommens-Kultur-Weltmeister-Nobelpreis entgegennehmen. 

Ich würds ihm von Herzen vergönnen.",3,0,0.0,1.0,1.0,1.0,0.0,0.0,1.0,0.0,0.0,0,Newsroom/Panorama/Flucht/Flucht_und_Politik/europathema,Noch tausend Flüchtlinge am Abend in Nickelsdorf,2015-09-20 19:43:56.000,"""Können die Österreicher nicht irgendwann sagen, dass sie genug haben?"" Schließlich sind wir Deutschen bessere Menschen als je zuvor.     Deshalb müssen wir alle Österreicher (bis Juni/Juli 2015 jeweils auf Platz 3 nach Schweden und Malta) bereits mehr Flüchtlinge aufnehmen als gute Deutsche.    Schließlich sollten wir Willkommenskultur-Weltmeister sein!    Für unsere Herzlichkeit und alle Flüchtlinge hoffen wir, dass Merchen bald den Welcome Culture Weltmeister-Nobelpreis entgegennehmen kann.     Ich gebe ihm Herz.",kn
6032,350718,,4082,12197,2015-10-04 20:26:58.747,online,,Schwimmt der auf der anderen Seite des Flußufers? So hört er sich nämlich an...,0,0,0.0,1.0,1.0,1.0,0.0,0.0,1.0,0.0,0.0,0,Newsroom/Web/Webvermischtes,"Österreichischer Youtube-Star: ""Hello friends, ich bin eh ganz normal""",2015-10-04 16:45:09.000, Schwimmt er auf der anderen Seite des Flussufers? Er klingt wie...,kn
6096,385218,385217.0,4498,11311,2015-10-17 21:12:53.677,deleted,,"""Frischer Wind in die religöse Ebene""...
Genau darauf kann hundertprozentig verzichtet werden! Über alles andere kann man reden, aber ein Europa, wo in 30 Jahren von jedem Kirchturm ein Muezzin herunterschreit, das brauchen wir ganz sicher nicht! Europäische Religionskriege, Aufklärung und Revolutionen gegen den Feudalismus dürfen nicht umsonst gewesen sein. Es kann einfach nicht sein, dass in Zukunft patriarchalische Hinterwäldler mit mittelalterlichen Gesellschaftsvorstellungen unsere Politik bestimmen! Wenn wir nicht aufpassen, kommt es aber so, siehe Kosovo. Dort leben heute aufgrund ihrer hohen Geburtenrate 90% großteils islamische Albaner und nur noch 7% Serben. Vor 100 Jahren war es genau umgekehrt.",0,0,1.0,1.0,0.0,1.0,0.0,0.0,1.0,0.0,0.0,0,Newsroom/Panorama,Bayern: AfD marschierte an Grenze zu Salzburg auf,2015-10-17 15:10:52.000," ""Neue Luft in die religiöse Ebene""...  Es kann von genau 100% verteilt werden! Wir können über alles reden, aber wir brauchen Europa, wo Muzzin in 30 Jahren von jedem Kirchturm herabschreit! Europäische Religionskriege, Aufklärung und Revolutionen gegen den Feudalismus dürfen nicht umsonst sein. In Zukunft werden patriarchalische Anhänger mit mittelalterlichen gesellschaftsischen Ideen unsere Politik bestimmen! Wenn wir jedoch nicht aufpassen, wird es passieren, schauen Sie sich den Kosovo an. Aufgrund ihrer hohen Geburtenrate leben heute 90 % der islamischen Albaner und nur 7 % der Serben dort. Das eine war vor 00 00 Jahren, es war umgekehrt.",kn
8079,616098,616094.0,7363,30704,2016-01-16 16:37:08.693,online,,"Nein, natürlich gibt es nicht eine einzig richtige Lebensweise.

ABER wenn man in einem fremden Land aufgenommen wird, muss man nicht meinen dessen Bevölkerung von der eigenen Lebensweise und den eigenen Werten überzeugen zu müssen. 
Genau das passiert doch gerade.

Auf Afrika geh ich nicht näher ein. Da müsste man zu weit ausholen. Ich hoffe nur die Millionen, welche an der Küste warten bleiben uns erspart, so hart es klingt.

Und klar beruht unser Wohlstand auf der Armut der anderen, das hat jedoch jeder selbst in der Hand. Solange man in einen Kik oder Primarkt rennt wird sich das auch nicht ändern.
Ein wenig Eigenverantwortung und Bewusstsein sollte dann schon sein.",0,0,1.0,1.0,0.0,1.0,0.0,0.0,1.0,0.0,0.0,0,Newsroom/International/Afrika/BurkinaFaso,Burkina Faso: Mindestens 23 Tote bei Angriff auf Hotel,2016-01-15 21:53:28.300," Nein, natürlich gibt es keine richtige Lebensweise.    Aber wenn man im Ausland akzeptiert wird, muss man seine Bevölkerung nicht von seiner eigenen Lebensweise und Werten überzeugen.   Das ist es, was passiert.    Ich gehe nicht mehr nach Afrika. Sie müssen zu weit gehen. Ich hoffe, dass die Millionen von Menschen, die an der Küste warten, uns so hart retten werden, wie es klingt.    Und natürlich basiert unser Wohlstand auf der Armut anderer, aber jeder hat ihn in der Hand. Solange du zum Kicken oder Premarkt laufst, wird sich das nicht ändern.  Es muss bereits eine gewisse Eigenverantwortung und ein gewisses Bewusstsein geben.",kn
8089,620099,,7408,13173,2016-01-17 20:57:44.633,deleted,,"Da war aber sehr viel Arglosigkeit bei diesem Mädchen dabei...
Hoffentlich ist dieser Vorfall eine WARNUNG für alle Mädchen im Lande!",0,0,0.0,1.0,0.0,1.0,0.0,0.0,1.0,0.0,0.0,0,Newsroom/Panorama/Chronik,18-Jährige in Wien vergewaltigt,2016-01-17 15:27:49.000," Aber es gab eine Menge Arroganz mit diesem Mädchen...  Hoffe, dass dieser Vorfall eine Warnung an alle Mädchen im Land ist!",kn
8144,646029,646016.0,7671,27532,2016-01-26 07:21:11.283,online,,"Wer die Postings hier liest, weiß, dass wir auch wieder kurz vor 1938 stehen.",0,2,0.0,1.0,1.0,1.0,0.0,0.0,1.0,0.0,0.0,0,Newsroom/International/Asien/Afghanistan,"""Die Ideologie des IS hat in Afghanistan tiefe Wurzeln""",2016-01-25 13:02:00.000," Wer hier Postings liest, weiß, dass wir wieder am Rande des 1938 stehen.",kn
8324,734650,,8777,16183,2016-02-26 04:39:46.010,online,,"Wenn in Schweden 10 Mal mehr Frauen vergewaltigt werden als in allen anderen europaeischen Laendern, und die Taeter zu 90% dem arabisch-islamischen Kulturkreis entstammen, bin ich dann ein Hetzer, wenn ich mir erlaube, diese Tatsache vorzubringen? 

Diese Zahlen, die in Schweden immer unter den Tisch gekehrt wurden, kommen jetzt nach Koeln alle ans Tageslicht und ich finde sie erschuetternd!

So kann das doch nicht weiter gehen!",4,0,1.0,1.0,0.0,0.0,0.0,0.0,1.0,0.0,0.0,0,Newsroom/Inland/Sachpolitik/integrationpolitik,Asylwerber in Wien sind gefangen zwischen den Welten,2016-02-25 09:39:14.000," Würde ich es hassen, wenn zehnmal mehr Frauen vergewaltigt würden als jedes andere europäische Land in Schweden, und 90 % der Reifen aus der arabisch-islamischen Kultur stammten, wenn ich das sagen durfte?     Diese Zahlen, die in Schweden immer unter den Tisch gekehrt wurden, kommen jetzt nach Coeln ans Licht und ich werde sie im Voraus finden!    Es geht nicht mehr!",kn
8432,777228,,9243,19907,2016-03-09 17:08:52.240,online,,"Es bleibt zu hoffen, das keine westliche Großmacht versucht Nordkorea die Demokratie zu bringen.
Ansonsten befürchte ich, das die ""next Gen"" Halsabschneider in 10 - 15 Jahren aus Koreanern mit Migrationshintergrund bestehen werden ...",1,7,0.0,1.0,0.0,0.0,0.0,0.0,1.0,0.0,0.0,0,Newsroom/International/Asien/Koreakrise/Nordkorea,Nun droht Kim mit Mini-Atomsprengköpfen,2016-03-09 10:59:43.000," Es bleibt zu hoffen, dass keine große westliche Macht versuchen wird, Nordkorea Demokratie zu bringen.  Ansonsten fürchte ich, dass in 10 bis 15 Jahren die ""next Gen"" Halsschneider aus Koreanern mit Migrationshintergrund bestehen ...",kn
8458,789704,,9401,7448,2016-03-15 08:53:11.497,deleted,,"Den Hellenen ist das doch nur recht! Können sie sich schön abputzen und unsere Knete kassieren, obwohl sie niemanden versorgen. Das sind echt durchtriebene Typen.",4,1,0.0,1.0,0.0,0.0,0.0,0.0,1.0,0.0,0.0,0,Newsroom/Panorama/Flucht/Fluchtgeschichten,"Flüchtlinge verlassen Idomeni – Athen: ""Organisierte Flugblattaktion""",2016-03-14 14:46:57.770," Nur die Höllen sind richtig! Auch wenn sie niemanden versorgen, können sie sich gut reinigen und unsere Schlüsselstücke abholen? Das sind wirklich rechte Jungs.",kn
8490,800467,,9574,12263,2016-03-18 13:49:06.493,online,Unsinn,"Ähnlichkeiten gibt es immer und zu allem. Damals hatte man die heutigen Erfahrungen nicht. Den Pöbel gibt es klarerweise immer noch. Aber auch viel mehr Wissende und Vernünftige. Natürlich nicht am Balkan, aber im Westen.  Und dieser bestimmt die Geschehnisse im Rest der Welt, zum Glück.",0,3,1.0,1.0,1.0,0.0,0.0,0.0,1.0,0.0,0.0,0,Newsroom/International,"Kriegsforscherin: ""Die Welt bewegt sich zurück zur Unordnung""",2016-03-18 05:30:00.000,"Es gibt immer und alle von euch zu wissen, was los ist. Damals hatten wir heute keine Erfahrung. Es ist klar, dass die Menge immer noch existiert. Aber sachkundiger und vernünftiger. Nicht auf dem Balkan, sondern im Westen.  Und es wird glücklicherweise bestimmen, was im Rest der Welt geschieht.",kn
8493,801001,801000.0,9589,947,2016-03-18 18:42:24.083,online,,"Ich hatte während meiner Schulzeit vor zig-Jahren einige muslimische Mitschüler, diese unterschieden sich in nichts von uns. Sie waren angezogen wie wir, sprachen perfekt Deutsch, waren sehr gute Schüler, wir  haben uns alle sehr gut mit ihnen vertragen, es gab nie ein Problem! Und das sage ich nicht nur aus heutiger Sicht. Die ""neuen"" Muslime haben das alles nicht mehr nötig: sie lernen weder Deutsch noch sonst was in der Schule, stören den Unterricht, behandeln LehrerINNEN respektlos, Lehrer genauso, verhalten sich gegenüber Österreichern oft frech (aus mangelndem Selbstbewusstsein) usw. Also von einem unbegründetem Rassismus kann wohl keine Rede sein. Wen wundert das?",26,0,1.0,1.0,0.0,0.0,0.0,0.0,1.0,0.0,0.0,0,Newsroom/Inland/Sachpolitik/ipokirche,Feindbild Muslime als europaweites Phänomen,2016-03-18 18:01:19.000," Ich hatte einige muslimische Klassenkameraden, als ich vor zehn Jahren in der Schule war, und sie waren nicht anders als wir. Sie waren wie wir gekleidet, sprachen absolut Deutsch, waren sehr gute Schüler, wir haben uns alle gut mit ihnen vergist, es gab nie ein Problem! Und das sage ich aus heutiger Sicht nicht. ""Neue"" Muslime brauchen das alles nicht mehr: Sie lernen Deutsch oder irgendetwas anderes in der Schule, unterbrechen den Unterricht nicht, behandeln Lehrer respektlos, Lehrer tun dasselbe, verhalten sich oft frech über Österreicher (aus Mangel an Vertrauen) etc. Von unbegründeten Rassismus kann also keine Rede sein. Wer wundert sich darüber?",kn
8549,823426,,9879,7721,2016-03-29 12:12:00.747,online,,"Irgendwo habe ich gelesen, dass das Model ihn auch frisiert. Vor ein paar hundert Jahren hat man solche Frauen verbrannt.",0,0,0.0,1.0,1.0,0.0,0.0,0.0,1.0,0.0,0.0,0,Meinung/Kolumnen/rau,The next First Lady,2016-03-28 17:55:34.140," Irgendwo las ich, dass das Modell ihn einfrierte. Vor ein paar hundert Jahren wurden solche Frauen verbrannt.",kn
8694,889641,,10600,5914,2016-04-18 19:50:08.723,online,Dieser Mensch mag die Menschen nicht,"Wenn man sich selbst als Elite sieht (Burschenschafter-Denken), dann teilt man die ""Untermenschen"" unter sich halt gern in Gut und Böse auf.

Muss jeder selbst wissen, ob man jemanden wählen will - der offensichtlich keine Menschen mag.",19,2,0.0,1.0,0.0,0.0,0.0,0.0,1.0,0.0,0.0,0,Newsroom/Inland/bundespraesi,Hofer: AMS soll Migranten keine Jobs vermitteln,2016-04-18 16:29:51.000,"Dieser Mensch mag keine Menschen Wenn man sich als Elite sieht (Berschenschafter-Denken), dann teilt man gerne ""untermenschliche Wesen"" zwischen sich selbst als gut und schlecht auf.    Jeder muss selbst wissen, ob er jemanden wählen will - er mag die Leute offensichtlich nicht.",kn
8754,923281,,10994,12110,2016-04-29 08:40:15.217,online,,"Die Flüchtlinge wissen genau, was sie vom Gastgeberland erwarten. Die sind in diesem Punk knallhart, so meine eigene persönliche Erfahrung.",32,0,0.0,1.0,0.0,0.0,0.0,0.0,0.0,1.0,0.0,0,Newsroom/Panorama/Flucht/Flucht_und_Politik,Kurz verteidigt mögliche Grenzkontrollen am Brenner,2016-04-29 05:35:34.000," Flüchtlinge wissen genau, was sie vom Gastland erwarten. Sie trafen diesen Punk, also meine persönliche Erfahrung.",kn
8943,991168,,11892,28609,2016-05-25 22:15:02.737,online,"Verteidiger Wolfgang Blaschitz hatte auf den nun ordentlichen Lebenswandel seines Mandanten, der im Juni zum zweiten Mal Vater wird, verwiesen","Und dann zum dritten, vierten, fünften ... Mal.",5,2,0.0,1.0,0.0,0.0,0.0,0.0,1.0,0.0,0.0,0,Newsroom/Panorama/Chronik,Teilbedingte Haft für mutmaßlichen Syrien-Kämpfer in Krems,2016-05-25 18:27:16.000,"Verteidiger Wolfgang Blasthitz hatte den inzwischen geordneten Lebensstil seines Mandanten erwähnt, der im Juni zum zweiten Mal Vater wird, und dann zum dritten, vierten, fünften... B.",kn
3626,27821,27820.0,447,3112,2015-06-11 18:08:32.163,deleted,,"erstens ist die Zahl erfunden, und selbst wenn..., wenn deren kultureller Hintergrund der ""anatolische Islam"" gewesen wäre, dann wärs nix mit Gleichberechtigung zw. Mann und Frau, nix mit Life Ball, Conchita Wurst usw. ums mal so zu formulieren",5,1,0.0,1.0,0.0,0.0,0.0,0.0,1.0,0.0,0.0,0,Newsroom/Panorama/Gesellschaft/demografischerwandel,Österreichs Bevölkerung wuchs im Vorjahr um 77.000 Menschen,2015-06-11 13:01:46.000," erstens ist die Zahl erfindungsgemäß, und sogar ... wenn ihr kultureller Hintergrund ""Anatolian Erden"" ist, dann gibt es keine Gleichheit zwischen Mann und Frau, nichts auf Life Ball, Conchita Wurst usw.",fil
4463,77217,77211.0,1178,28291,2015-09-07 20:45:29.993,online,"vor aölem nach den müllbergen am wochenende, die die gemeinde von den türken dann auf gemeindekosten entsorgen darf..",,2,0,0.0,1.0,0.0,0.0,0.0,0.0,1.0,0.0,0.0,0,daStandard/daAlltag,"""Verschmutzte Parks, laute Kinder, Ausländer""",2015-06-30 21:11:04.000,"vor aölem nach den Müllbergen am Wochenende, wo die Gemeinde von den Türken auf kommunale Kosten geworfen werden kann. ",fil
5075,148473,,1924,27712,2015-07-25 00:32:56.873,online,"Hallo Thomas,","ich mache Dich darauf aufmerksam, daß Du hier in Gutmenschen-Forum unterwegs bist! Hier gibt's keine Gnade!",1,8,0.0,1.0,1.0,1.0,0.0,0.0,1.0,0.0,0.0,0,Newsroom/Web/Netzpolitik/Hasspostings,Porsche entlässt Lehrling nach Hassposting auf Facebook,2015-07-24 11:09:44.000,"Hallo Thomas, ich möchte Ihre Aufmerksamkeit auf die Tatsache richten, dass Sie hier im Gutmenschen-Forum sind! Hier gibt es keine Gnade!",fil
5434,246926,246925.0,2928,5179,2015-08-27 17:08:08.170,online,,Hat der Fahrer von jedem vermuteten Flüchtling 10.000 Euro erhalten?,0,0,0.0,1.0,0.0,0.0,0.0,0.0,1.0,0.0,0.0,0,Meinung/Kommentare/FoederlSchmid,Die EU kann etwas gegen Schlepper tun,2015-08-27 16:02:49.000, Hat der Fahrer von jedem mutmaßlichen Flüchtling 10.000 Euro erhalten?,fil
5436,247490,,2943,19686,2015-08-28 13:15:37.740,online,"Wann gibts den ersten Politiker/die erste Politikerin,","die aus Prinzip nicht mehr mit der Krone spricht? Das ekelhafte Hetzblatt hat sich schon vollständig als »Nachrichtenmedium« disqualifiziert.

So was muss man nicht zu PKs einladen, sowas muss man keine Interviews geben. Und vor allem muss sich der journalistische Berufsstand sich bei der Nase nehmen und sicherstellen, dass jemand, der auch nur einen Tag dort gearbeitet hat, nie wieder bei einem anderen Medium Arbeit bekommt. Das sind keine KollegInnen!",16,3,0.0,1.0,1.0,0.0,0.0,0.0,1.0,0.0,0.0,0,Newsroom/Etat/PRINT/Mediaprint/krone,"""Krone""-Foto mit toten Flüchtlingen ""unentschuldbar""",2015-08-28 12:42:35.240,"Wann wird es den ersten Politiker geben, der im Prinzip nicht mehr zur Krone spricht? Die nervigen wütenden Blätter sind selbst als ""neues Medium"" völlig unwürdig.    Du musst dich nicht so zu PKS einladen, du musst keine Interviews wie diese geben. Und vor allem muss der Journalist auf sich selbst schauen und dafür sorgen, dass jemand, der mindestens einen Tag dort gearbeitet hat, nie wieder einen Job für ein anderes Medium bekommt. Sie sind keine Kollegen!",fil
5493,290992,290984.0,3398,24176,2015-09-10 21:57:03.907,online,,na ich hoffe der ungebremste zuzug von moslems bzw deren einbürgerung wird dann irgendwie erschwert oder gar gestoppt.,10,3,0.0,1.0,0.0,0.0,0.0,0.0,1.0,0.0,0.0,0,Newsroom/Panorama/Flucht/Flucht_und_Politik/europathema,Ungarn winkt Flüchtlinge nach Österreich durch – rund 7.500 am Donnerstag,2015-09-10 17:50:54.840," Ich hoffe, dass der unglaubliche Einfluss der Muslime oder ihre Einbürgerung härter oder sogar gestoppt wird.",fil
5964,318890,318886.0,3650,7263,2015-09-21 00:13:53.707,online,"""Dürfen die Österreicher nicht auch irgendwann sagen dass sie genug haben?""","Wir sind schließlich noch bessere Menschen als es die Deutschen jemals sein werden. 

Darum müssen wir Österreicher pro-Kopf (bis Juni/Juli 2015 an der 3. Stelle pro-Kopf nach Schweden und Malta) auch mehr Flüchtlinge aufnehmen als die ohnehin schon guten Deutschen.

Wir müssen schließlich WILLKOMMENS-KULTUR-WELTMEISTER werden!

Hoffentlich kann unser herzlicher und für alle Flüchtlinge sich erbarmender Faymann bald - und für alle Ewigkeiten - den Willkommens-Kultur-Weltmeister-Nobelpreis entgegennehmen. 

Ich würds ihm von Herzen vergönnen.",3,0,0.0,1.0,1.0,1.0,0.0,0.0,1.0,0.0,0.0,0,Newsroom/Panorama/Flucht/Flucht_und_Politik/europathema,Noch tausend Flüchtlinge am Abend in Nickelsdorf,2015-09-20 19:43:56.000,"""Können die Österreicher nicht sagen, dass sie genug Geld haben?"" Schließlich sind wir bessere Menschen als die Deutschen.     Deshalb müssen die Österreicher pro Hauptstadt (bis Juni/Juli 2015 auf Dem 3. Platz nach Schweden und Malta) auch mehr Zuflucht suchen als gute Deutsche.    Schließlich müssen wir bei den Kulturweltmeistern willkommen sein!    Hoffentlich wird unsere Herzlichkeit und für alle Flüchtlinge, Faymann, die barmherzig sind, bald den Welcome Culture Weltmeister-Nobelpreis erhalten.     Ich gebe ihm mein Herz.",fil
6032,350718,,4082,12197,2015-10-04 20:26:58.747,online,,Schwimmt der auf der anderen Seite des Flußufers? So hört er sich nämlich an...,0,0,0.0,1.0,1.0,1.0,0.0,0.0,1.0,0.0,0.0,0,Newsroom/Web/Webvermischtes,"Österreichischer Youtube-Star: ""Hello friends, ich bin eh ganz normal""",2015-10-04 16:45:09.000, Schwimmt er auf der anderen Seite des Flusses? So klingt er...,fil
6096,385218,385217.0,4498,11311,2015-10-17 21:12:53.677,deleted,,"""Frischer Wind in die religöse Ebene""...
Genau darauf kann hundertprozentig verzichtet werden! Über alles andere kann man reden, aber ein Europa, wo in 30 Jahren von jedem Kirchturm ein Muezzin herunterschreit, das brauchen wir ganz sicher nicht! Europäische Religionskriege, Aufklärung und Revolutionen gegen den Feudalismus dürfen nicht umsonst gewesen sein. Es kann einfach nicht sein, dass in Zukunft patriarchalische Hinterwäldler mit mittelalterlichen Gesellschaftsvorstellungen unsere Politik bestimmen! Wenn wir nicht aufpassen, kommt es aber so, siehe Kosovo. Dort leben heute aufgrund ihrer hohen Geburtenrate 90% großteils islamische Albaner und nur noch 7% Serben. Vor 100 Jahren war es genau umgekehrt.",0,0,1.0,1.0,0.0,1.0,0.0,0.0,1.0,0.0,0.0,0,Newsroom/Panorama,Bayern: AfD marschierte an Grenze zu Salzburg auf,2015-10-17 15:10:52.000," ""Frische Luft auf den Ebenen der Religion""...  Genau darauf kann man 100% verzichten! Wir können über alles andere reden, aber wir brauchen europa, wo seit 30 Jahren ein Maulkorb aus jedem Kirchturm schreit! Religionskriege in Europa, Aufklärung und Revolution gegen die Feudalität sollten nicht bedeutungslos sein. Es ist nicht nur so, dass in Zukunft patriarchalische Hinterbänkler mit mittelalterlichen gesellschaftsischen Ideen unsere Politik bestimmen! Wenn wir jedoch nicht aufpassen, wird es passieren, siehe Kosovo. Aufgrund ihrer hohen Geburtenrate leben heute 90 % der islamischen Albaner und nur 7 % der Serben dort. Vor 000 Jahren ist das ein anderer Weg.",fil
8079,616098,616094.0,7363,30704,2016-01-16 16:37:08.693,online,,"Nein, natürlich gibt es nicht eine einzig richtige Lebensweise.

ABER wenn man in einem fremden Land aufgenommen wird, muss man nicht meinen dessen Bevölkerung von der eigenen Lebensweise und den eigenen Werten überzeugen zu müssen. 
Genau das passiert doch gerade.

Auf Afrika geh ich nicht näher ein. Da müsste man zu weit ausholen. Ich hoffe nur die Millionen, welche an der Küste warten bleiben uns erspart, so hart es klingt.

Und klar beruht unser Wohlstand auf der Armut der anderen, das hat jedoch jeder selbst in der Hand. Solange man in einen Kik oder Primarkt rennt wird sich das auch nicht ändern.
Ein wenig Eigenverantwortung und Bewusstsein sollte dann schon sein.",0,0,1.0,1.0,0.0,1.0,0.0,0.0,1.0,0.0,0.0,0,Newsroom/International/Afrika/BurkinaFaso,Burkina Faso: Mindestens 23 Tote bei Angriff auf Hotel,2016-01-15 21:53:28.300," Nein, natürlich gibt es keine richtige Lebensweise.    Aber wenn man im Ausland akzeptiert wird, braucht man seine Bevölkerung nicht in Ihrer eigenen Lebensweise und Ihren Werten zu überzeugen.   Das ist genau das, was vor sich geht.    Ich gehe nicht mehr nach Afrika. Man muss zu weit gehen. Ich hoffe, dass Millionen wartender Aliens uns sehr ähnlich wie sein Klang retten werden.    Und es ist klar, dass unser Vorhaben auf der Armut anderer basiert, aber alles liegt in ihren eigenen Händen. Solange man in Kik oder Primarkt läuft, wird sich daran nichts ändern.  Einige persönliche Verantwortung und Bewusstsein sollte immer sein.",fil
