,id_post,id_parent_post,id_article,id_user,created_at,status,headline,body,positive_votes,negative_votes,label_argumentsused,label_discriminating,label_inappropriate,label_offtopic,label_personalstories,label_possiblyfeedback,label_sentimentnegative,label_sentimentneutral,label_sentimentpositive,is_staff,article_path,article_title,article_publishing_date,text,lang
7559,520617,520616.0,6157,23608,2015-12-06 20:10:35.897,online,,lernens amoi die grammatik verdammt nommoi!,0,4,0.0,0.0,1.0,1.0,0.0,0.0,1.0,0.0,0.0,0,Newsroom/Inland/Bildung/Schueler/schuelerreligion,Krach um Kindergärten im Zeichen des Korans,2015-12-06 17:56:54.000, lernen Geruch die grammatischen Traum nommoi!,fil
7562,525383,525382.0,6194,9008,2015-12-07 19:26:38.377,online,Wer schafft denn Arbeitsplätze?,"Gewerkschafts- oder Kammerfunktionäre?

Soziologie-Experten?

NGO-Keiler?

Wer?

???",13,4,0.0,0.0,0.0,0.0,0.0,0.0,1.0,0.0,0.0,0,Newsroom/Wirtschaft/Finanzen/Portfoliowirtschaft,"Vermögensforscher: ""Reiche sollten sich nicht isolieren""",2015-12-07 18:33:38.000,Wer schafft den Job? Gewerkschaften oder chariotische Handelsvertreter?    Soziologie-Experten?    NGO-Keile?    Wer?    ???,fil
7572,531051,531050.0,6284,25440,2015-12-10 11:33:18.937,online,,"bitte, bitte tuns ma keine probleme für frau w. machen.
die gehört doch zur familie, zum clan.
wer eines der mitglieder angreift, greift den häuptling an, den herrn h. und im falle der frau w. auch den herrn s., einen zwar aalglatten aber trotzdem unfähigen rotgefärbten schwarzen, der bei jeder pressekonferenz ausschaut, als hätte er sich im saal geirrt. einem fachmann für rein gar nix ausser unverbindlich plauschen.
nein, die können keine fehler machen.
alle ist gut und wird gut. glaubens ma das.
bei meiner ehr und meinem fluchtachterl.",1,0,0.0,0.0,1.0,1.0,0.0,0.0,1.0,0.0,0.0,0,Newsroom/Panorama/Gesellschaft/integrationpano,Wien: Religionsleitfaden für Kindergärten kommt,2015-12-09 18:10:05.000," bitte machen Keine Probleme für die Frau w.  es wird von der Familie geliebt, im Clan.  Wer eines der Mitglieder angreift, greift den Baum an, den Herrn h. und den Fall der Frau w. sowie des Meisters, eine glatte, aber Unfähigkeit zu Rot-Schwarz, die bei jeder Pressekonferenz liegt, als ob sie sich im Flur geirrt hätte. ein Spezialist für nichts als unverbindliche Chats.  nein, sie können keine Fehler machen.  alle sind gut und gut. glauben Sie das.  zu meiner Ehre und meinem Fluch.",fil
7581,533964,533955.0,6322,23560,2015-12-11 11:18:49.110,online,,Und so? Tut es das schon ab 1.1.2016. Intelligente Lösung.,0,0,0.0,0.0,0.0,0.0,0.0,0.0,1.0,0.0,0.0,0,Newsroom/User/mitmachen,Grunderwerbsteuer: Vererben oder verschenken?,2015-12-11 05:30:00.000, Also? Tut er dies bereits am 1.1.2016. Intelligente Lösungen.,fil
7587,535326,535324.0,6355,18850,2015-12-12 07:21:42.260,online,,Nur wenn es was zu raunzen gibt.  Perfekt.,6,0,0.0,0.0,0.0,1.0,0.0,0.0,1.0,0.0,0.0,0,Newsroom/Panorama/Chronik/Verkehrssache/oeffentlicher_verkehr,Neuer ÖBB-Fahrplan ändert Pendlerströme durch Wien,2015-12-11 17:49:16.000," Nur, wenn etwas auf dem Widder ist.  perfekt.",fil
7594,538296,,6393,30950,2015-12-13 16:38:44.087,online,,"Cool. So kommt man schnell und billig zu den Volltrotteln. Nur so weiter...
Wie deppert geht's eigentlich noch???",12,0,0.0,0.0,1.0,0.0,0.0,0.0,1.0,0.0,0.0,0,Newsroom/Web/Netzpolitik,"Karlskirche: Fremdenfeinde wollen ""Moschee am Karlsplatz"" abreißen",2015-12-13 12:11:16.000, Cool. So kommen Sie schnell und billig über die Trabe. Just In The...  Wie deppert ist es immer noch möglich???,fil
7615,548198,,6502,9343,2015-12-16 18:51:13.703,online,Terror,"Warum und weshalb, sollte die Türkei eine Organisation keinen Halt bieten dürfen? 

Nur weil die sich in Zivil bzw. in Frauenkleidung mit Kopfbedeckung sich verstecken und Granaten auf die Polizisten feuern, dürfen die Sicherheitsbehörden sich töten lassen! Na dann ist es ja kein Problem, demnächst ist das Problem sowieso erledigt von euer Seiten aus, weil ihr 
tun und lassen könnt was ihr wollt! Schulen usw. die Kinder nicht besuchen lassen, aber sich ärgern, wenn der Staat die Lehrer zurück ordert, ärgert ihr euch! Geld für Strom, Gas usw.  ""Nein Zahlt ihr Nicht"" weil ihr die Kurden die auserwählten dieser Welt seit, wenn ihr in Europa was schlechtes anrichtet seit ihr sowieso Türken und verdreckt euren Namen nicht!!",4,27,0.0,0.0,0.0,0.0,0.0,0.0,1.0,0.0,0.0,0,Newsroom/International/Europa/Tuerkei,Furcht vor Bürgerkrieg in der Südosttürkei,2015-12-16 16:43:42.000,"Terror Warum und warum sollte die Türkei nicht eine Organisation aufhalten?     Nur wegen der erb- oder Frauenkleidung mit Kopfbedeckungunden und Feuergranaten an die Polizei dürfen die Sicherheitsbehörden getötet werden! Nun, dann ist es kein Problem, bald ist das Problem von Ihrer Seite getan, weil Sie tun und lassen können, was Sie wollen! Schulen usw. Lassen Sie die Kinder nicht besuchen, aber ärgern Sie sich, wenn Lehrer befehlen, Sie sind ärgerlich! Geld für Strom, Gas usw.  ""Du zahlst nicht"", weil du die Kurden der auserwählten Welt bist, weil, wenn du etwas Schlechtes in Europa tust, weil du immer noch Türken bist und deinen Namen nicht zerstörst!!",fil
7620,549211,,6517,25383,2015-12-17 12:46:45.060,online,Einer Leiche den Titel aus den toten Händen reißen.,"Seine Forschungen waren nicht nur bekannt sondern auch Grundlage der Ehrung. Wenn man rückblickend ein Problem damit hat, dann sollte man vielleicht erst die Ehrenden und die Folgen ihrer Handlungen genauer anschauen, bevor man meint es wäre mit einer posthumen Titelaberkennung einfach so erledigt.",15,12,1.0,0.0,0.0,0.0,0.0,0.0,1.0,0.0,0.0,0,Newsroom/Inland/Bildung/uni,Uni Salzburg widerruft Ehrendoktorat für Konrad Lorenz,2015-12-17 10:37:12.000,"Reißen Sie den Titel aus den toten Händen eines Körpers. Seine Forschung ist nicht nur bekannt, sondern basiert auch auf Ehre. Wenn Sie in Bezug auf sie hier Schwierigkeiten haben, müssen Sie vielleicht zuerst die Ehre und die Folgen ihrer Handlungen betrachten, bevor Sie denken, dass dies in einem posthumen Titelentzug geschehen kann.",fil
7873,552202,552195.0,6566,2189,2015-12-18 16:18:34.193,online,Laut schreien,"und nix wissen...
Die Regelung ist bei uns viel schärfer als in UK. Und trotzdem konform mit EU-Recht.
Kurz gefasst: der dich so empörende Fall ist unmöglich.",2,0,1.0,0.0,1.0,0.0,0.0,0.0,1.0,0.0,0.0,0,Newsroom/International/Europa/Grossbritannien,Brexit: Cameron hält an Einschränkung von Sozialleistungen fest,2015-12-18 14:51:44.760,"Schreien laut und unbekannt...  Die Regulierung ist für uns strenger als im Vereinigten Königreich. Aber es ist kompliziert im EU-Recht.  Mit anderen Worten, der Fall, der Sie so entmutigt, ist unmöglich.",fil
7875,553428,553425.0,6578,1140,2015-12-18 22:58:37.640,online,,"Vorallem das Sonnwendviertel, zerstört die gewachsene Grätzlstruktur der Kreta - furchtbar!",1,0,0.0,0.0,0.0,1.0,0.0,0.0,1.0,0.0,0.0,0,Newsroom/Panorama/wien,Die Wiener fühlen sich ziemlich sicher,2015-12-18 17:53:40.000, Vor allem das Sonnwendviertel zerstört die wachsende Grötzl-Struktur Kretas - schrecklich!,fil
7880,554452,554450.0,6599,6231,2015-12-19 20:54:34.337,online,,Sie sind damit hip und haben ein crowdgefundetes Spielzeug gekauft. Quasi das craft beer unter den Leuchten!,9,0,0.0,0.0,0.0,0.0,0.0,0.0,1.0,0.0,0.0,0,Newsroom/Web/ITBusiness/Startupweb,Fluxo: Smarte Lampe aus Österreich ermöglicht volle Lichtkontrolle,2015-12-19 10:09:52.000, Sie hip und kaufen eine Menge Leute. Fast das Craft-Bier unter dem Licht!,fil
7881,554468,554460.0,6601,961,2015-12-19 23:18:31.893,deleted,,"Der nationalsozialismus hat ihn, mit dem ueberall sonst auf der welt die voelker schon seit jahrhunderten geknechtet und auagerottet wurden,  nach Europa gebracht. Das war das Neue. Ohne Kolonialrassismus kein Nationalsizialismus.",0,0,1.0,0.0,0.0,0.0,0.0,0.0,1.0,0.0,0.0,0,Newsroom/Wissenschaft/Natur,Die verlorene Ehre des Konrad Lorenz,2015-12-18 20:22:32.000," Der Nationalsozialismus hat ihn nach Europa gebracht, wo Vokver seit Jahrhunderten Sklaven und Auageroted sind. Es war das neue. Ohne kolonialen Rassismus gibt es keinen nationalen Sizideismus.",fil
7888,558874,558870.0,6653,15735,2015-12-21 23:18:44.800,online,,"Ähm - Nein, auf sowas gehe ich nicht näher ein.

Habe noch nie jemanden getroffen, der stur und argumentationsresistent für Inzest UND Polygamie gekämpft hat. Viel Glück damit, gehen Sie in die Politik!
Übrigens, der Artikel war über eine (eben nicht eingeführte) gesetzliche Möglichkeit einer gleichgeschlechtlichen Ehe in Slowenien.",0,0,1.0,0.0,0.0,0.0,0.0,0.0,1.0,0.0,0.0,0,Newsroom/International/Europa/slowenien,Referendum: Slowenen stimmen gegen Homo-Ehe,2015-12-20 20:57:47.850," Um - Nein, ich gehe nicht zu so etwas.    Wer zu jemandem geflohen ist, der vor Wäldern und Polygamie geflohen ist, ist noch nicht erkannt worden. Viel Glück, gehen Sie in die Politik!  Unterwegs geht es in dem Artikel um eine (uneingeführte) rechtliche Möglichkeit der gleichgeschlechtlichen Ehe in Slowenien.",fil
7897,563267,563265.0,6734,5997,2015-12-24 19:49:05.347,online,,"Und wenn 20 Prozent frieren gehört die Demokratie und Rechtsstaatlichkeit abgeschafft, oder wie? Hören davon diese 20 Prozent dann zu frieren auf?",0,0,0.0,0.0,0.0,0.0,0.0,0.0,1.0,0.0,0.0,0,Newsroom/International/Europa/polen,"EU-Kommission betrachtet Polens Gesetzesänderungen als ""ungültig""",2015-12-23 18:18:53.160," Und wenn 20 Prozent des Einfrierens im Besitz von Demokratie und Rechtsstaatlichkeit sind, oder wie? Hat das 20 Prozent aufgehört?",fil
7913,570452,,6816,20237,2015-12-28 15:12:11.810,online,Gute Verbindungen zwischen Staaten herstellen,"Ironie oder Sarkasmus?
Staatshäuptlinge schaffen es allerbestenfalls ein von ihnen angezetteltes Köpfeeinschlagen irgendwann auch wieder zu beenden. Und sogar das meistens erst dann, nachdem einer der Häuptlinge abserviert ist.",0,0,0.0,0.0,0.0,0.0,0.0,0.0,1.0,0.0,0.0,0,Newsroom/International/EU,EU: Mit Volldampf an die Lösung alter Probleme,2015-12-28 05:30:00.000,"Gute Verbindungen zwischen dem Staat, um Ironie oder Sarkasmus zu schaffen?  Staatschefs bei der besten Regierung, um eine Kopfzerbrechen zu beenden, die sie irgendwann angezettelt haben. Und auch wenn es in der Regel gerade nachdem einer der Häuptlinge ausgelassen wurde.",fil
7932,577540,,6897,14453,2016-01-01 12:46:09.030,online,"Unverschämt, wie man den Pröll durch den Kakao zieht",https://www.youtube.com/watch?v=Wb-LOzJnCog,0,0,0.0,0.0,0.0,1.0,0.0,0.0,1.0,0.0,0.0,0,Newsroom/Inland/bundespraesi,Die Entscheidung von Radlbrunn,2015-12-30 17:05:30.000,"Es ist schrecklich, wie man die Praxis durch den Trainer https://www.youtube.com/watch?v=Wb-LOzJnCog",fil
7935,577974,577973.0,6903,15770,2016-01-01 17:11:18.703,online,,Und wieviele Kopeken hast mit derlei sinnlosen Aktionen dann eingespart?,0,0,0.0,0.0,1.0,0.0,0.0,0.0,1.0,0.0,0.0,0,Newsroom/Web/ITBusiness,PC-Markt dürfte weiter schrumpfen – Kein Verkaufsschub durch Windows 10,2016-01-01 10:44:00.000, Und wie viele Konkurrenten wurden in solchen vergeblichen Aktionen gerettet?,fil
7939,579024,,6918,5261,2016-01-02 11:28:50.683,deleted,,"""Allerdings nicht nur im Netz, auch in großen österreichischen Tageszeitungen wurden falsche Behauptungen über Flüchtlinge verbreitet.""

Irgendwie süß. Gerade der Standard, euphorisiert von der Willkommenshysterie, hat da gleichsam an vorderster Front mitgewirkt (da gabs auf einmal nur mehr Asylwerber aus Syrien, fast alle hatten mindestens einen Uni-Abschluss, der Arbeitsmarkt konnte nicht überleben ohne, der IS würde NIE jemanden über den Balkan einschleusen, etc etc). Gut, ist nur vom Format her eine der ""großen"" Tageszeitungen, aber dennoch, Lügen gibts und gabs von beiden Seiten. Bitte aber nicht im Glashaus sitzen und mit Steinen werfen.",0,0,1.0,0.0,1.0,0.0,0.0,1.0,1.0,0.0,0.0,0,Newsroom/Web/Netzpolitik/Hasspostings,Hetze gegen Flüchtlinge: Schärferes Gesetz gegen Hass-Poster in Kraft,2016-01-01 10:03:38.000," ""Allerdings nicht nur im Netz, sondern auch in großen österreichischen Zeitungen jeden Tag über Flüchtlinge.""    Irgendwie süß. Vor allem die Kriterien, euphorisch durch die Begrüßung hysteriater, sind an der Front beteiligt (plötzlich gibt es mehr Asylsuchende aus Syrien, fast jeder hat mindestens einen Universitätsabschluss, der Arbeitsmarkt kann nicht überleben, ISIS wird nie in der Lage sein, eine Person auf dem Balkan zu bilden, etc. Nun, ist nur in Bezug auf das Format einer der ""großen"" Zeitungen jeden Tag, aber existiert und wird von beiden Seiten zur Verfügung gestellt. Aber bitte nicht im Spiegelhaus sitzen und die Steine wegwerfen.",fil
7955,584804,584788.0,6990,16887,2016-01-08 22:22:56.747,online,,"Industriell gehaltene Tiere verbrauchen 10x so viel Nahrung wie sie nach ihrem Tod abwerfen, bei ökologisch gehaltenen Tieren ist die Rate teilweise noch schlechter, da sie länger gehalten werden. In beiden Fällen werden letztlich aber leidensfähige Lebewesen umgebracht, selbst wenn man die Bio-Kuh zuvor nochmal umarmt hat. Fleischkonsum trägt einen großen Teil zur Regenwaldabholzung bei, verursacht Bodenerosionen, erzeugt Wasserknappheit in wasserarmen Regionen, begünstigt den Welthunger und hat noch viele weitere Folgen - für Tier UND Mensch.

Es ist also sehr wohl eine Frage des WAS.

Was jedoch nicht heißt, dass ich das Verhalten der erwähnten Veganern für gut befinde. Beruhigt aber bestimmt das Gewissen, auf andere zu zeigen.",2,0,1.0,0.0,0.0,0.0,0.0,0.0,1.0,0.0,0.0,0,Livingroom/Lifestyle/EssenTrinken,"Sarah Wiener: ""Habe mir noch nicht die Hörner abgestoßen""",2016-01-04 09:00:00.000," Industriell sind die Tiere der zehnfachen Tiere, solange sie nach ihrem Tod emittieren, und im Falle von Bio-Tieren ist die Rate manchmal sogar noch schlechter, weil sie länger gehalten werden. In beiden Fällen starb das leidende Geschöpf jedoch schließlich, obwohl die Biokühe wieder umarmt wurden. Der Fleischkonsum trägt zu einem großen Teil zum Wald bei, verursacht Bodenangst, verursacht einen Wassermangel in wasserarmen Regionen, fördert den Hunger in der Welt und viele andere Folgen - für Tiere und Menschen.    Es ist also definitiv eine Frage des WAS.    Aber das bedeutet nicht, dass das Verhalten der genannten Veganer gut ist. Aber das Gewissen ist beruhigt, andere über das Gewissen zu unterrichten.",fil
7975,586807,586806.0,7029,21007,2016-01-05 23:06:41.210,online,"Hoffentlich schafft sich der Verein ab, bevor er Österreichs Volksgesundheit und Familienplanung abgeschafft hat.",,7,0,0.0,0.0,0.0,0.0,0.0,0.0,1.0,0.0,0.0,0,Newsroom/Inland/Parteien/oevp,"Arbeitszeit: Zwölf-Stunden-Tag hat für Mitterlehner ""Toppriorität""",2016-01-05 13:09:00.000,"Hoffentlich wird sich der Verein selbst loswerden, bevor er die öffentliche Gesundheit und Planung der österreichischen Familie auflöst. ",fil
7982,590007,590004.0,7055,21150,2016-01-07 09:48:16.730,online,Sie transportieren schon wieder Ihre (eigentlich für Rechtsrechte typische) Des-Inforation,,0,0,0.0,0.0,0.0,0.0,0.0,0.0,1.0,0.0,0.0,0,Newsroom/Panorama/Weltchronik/Uebergriffe_Koeln,Köln: Mehrere Verdächtige nach Überfällen identifiziert,2016-01-07 05:49:35.550,Sie transportieren Ihre (wirklich häufig für gesetzliche Rechte) des inforation ,fil
7984,591273,591269.0,7064,28722,2016-01-07 18:07:00.403,online,,"1. woher wissen sie, dass es nur ""westliche"" frauen waren die betroffen sind. 2. geht es dabei nicht darum frauen als schlampen zu sehen, sondern darum, dass frauen objekte sind über die man locker macht (spricht belästigung, gewalt) ausüben kann ohne große konsequenzen zu fürchten. was ein problem in unserem rechtsstaat darstellt, genauso, dass die überfälle auf flüchtlingsheime in deutschland so gut wie nie  aufgeklärt werden (das ist ja geradezu eine einladung weiterzumachen). und wir werden ja sehen, welche konsequenzen es für die täter geben wird. aber wir haben schon gesehen, was mit opfern von prominenten tätern medial gemacht wird. und da liegt einiges im argen im vielgepriesenen westen.",2,4,1.0,0.0,0.0,0.0,0.0,0.0,1.0,0.0,0.0,0,Newsroom/User/Userkommentare,Je suis féministe: Klare Ansage statt Aufschrei,2016-01-05 17:29:47.000," 1. Wie werden sie wissen, dass dies ""westliche"" Frauen betroffen sind. 2. Es geht nicht darum, Frauen als zu betrachten, sondern um Dinge, die Frauen benutzen können (Sprechen deduziert, Gewalt), ohne große Konsequenzen zu befürchten. das ist ein Problem in unserem Rechtsstaat, ebenso wie die Tatsache, dass Razzien in Flüchtlingsheimen in Deutschland fast nie geklärt werden (es ist fast eine Einladung, weiterzumachen). und wir werden sehen, welche Folgen dies für die Waren hat. aber wir haben gesehen, was von prominenten Tätern in den Medien opferweise getan wird. und es gibt eine Sache in den Bösen im viel gepriesenen Westen.",fil
7992,591401,,7069,8464,2016-01-07 22:38:17.810,online,,"Und wieder eine neue, bewusst versuchte Verharmlosung.

In diese Dimension in mittlerweile 12 (?) Städten in nur 1 Nacht hat es noch NIE nicht einmal im Ansatz gegeben. Nur damit das einmal klargestellt ist.",54,1,1.0,0.0,0.0,0.0,0.0,0.0,1.0,0.0,0.0,0,Newsroom/Panorama/Weltchronik/Uebergriffe_Koeln,Silvesterübergriffe in Köln: Bundespolizist befürchtete Tote,2016-01-07 14:05:41.000, Und wieder versuchte es der Prozess absichtlich.    In dieser Größe bisher 12 (?) Städte in nur 1 Nacht haben noch nicht begonnen. Dass es klargestellt werden kann.,fil
8004,598114,,7122,26541,2016-01-09 10:05:31.893,online,tolle wahl mit tollen kandidaten wird das,da kommt mir nur in den sinn:  viele pfosten für einen posten,8,2,0.0,0.0,1.0,0.0,0.0,0.0,1.0,0.0,0.0,0,Newsroom/Inland/bundespraesi,Andreas Khol soll für ÖVP bei Präsidentenwahl kandidieren,2016-01-08 16:03:09.000,große Option mit guten Kandidaten ist es nur in meinem Kopf: viele Beiträge für einen Beitrag,fil
8007,599212,599211.0,7132,3428,2016-01-09 14:42:40.583,online,,"Sie kennen den konkreten Volkswillen nicht. Bin auch für Neuwahlen, aber lassen Sie diese arroganten Aussagen..",3,25,0.0,0.0,1.0,0.0,0.0,0.0,1.0,0.0,0.0,0,Newsroom/Panorama/Weltchronik,Deutschland erwartet 2016 eine Million Flüchtlinge,2016-01-09 13:16:30.000," Sie kennen den konkreten Willen des Volkes nicht. Bin auch für Neuwahlen, aber lassen Sie diese arroganten Aussagen..",fil
8013,602078,,7155,19257,2016-01-11 11:15:03.337,online,,"Als jemand, der nicht braun rumgrölt, steht man offensichtlich fix auf der Moderationsliste und kann nur mit Stunden  Verzögerung mit Freischaltung rechnen. Ein schönes Publikum hast dir da heran gezüchtet, Standard.",9,2,0.0,0.0,1.0,1.0,0.0,1.0,1.0,0.0,0.0,0,Newsroom/Panorama/Weltchronik/Uebergriffe_Koeln,Justizminister: Angriffe in Köln waren über soziale Netzwerke organisiert,2016-01-10 08:38:06.610," Als jemand, der nicht brüllt braun, Sie sind eindeutig stabil auf der Liste der Moderation und kann nur eine stündliche Verzögerung in der Aktivierung erwarten. Ein schöner Zuhörer produziert Sie dort, Standard.",fil
8015,602558,602556.0,7161,21058,2016-01-10 17:08:55.320,online,,"a ) Wer redet von ""Heilsbringern""? 
b) Sie vergleichen die US Präsidentschaft allen Ernstes mit dem Amt des österreichischen Bundespräsidenten?

Kritik ist ja durchaus erlaubt und in einer funktionierenden Demokratie auch wünschenswert, manche Handlungen VdBs kann man durchaus auch hinterfragen. Die Formulierung und das Timing  bringt aber sogar ein trotziger Schülerverein schwer zusammen. VdB Neoliberal? Profssiorales Image? Wer besser für die JG dann? Griss? Khol? Hundsdorfer? Und wenn sie, wie am Ende des Artikels angedeutet, lieber keinen hätten, dann ist's auch kurios, dass sie das erst ein paar Monate vor den Wahlen kundgeben.
Wieder einmal ein Beweis des Selbstzerfleischungs- und Ewigjammerinstinkts der Grünen .",1,0,1.0,0.0,1.0,0.0,0.0,0.0,1.0,0.0,0.0,0,Newsroom/Inland/bundespraesi,Grüne Jugend kritisiert Van der Bellens Kandidatur,2016-01-09 12:52:08.000," a ) Wer spricht von ""sicher""?   b) Sind Sie im Ernst mit der US-Präsidentschaft im Büro des österreichischen Bundespräsidenten verglichen?    Die Kritiker sind höchst erlaubt und in einer funktionierenden Demokratie können auch einige VDB-Aktionen vermutet werden. Aber das Wort und das Timing bringen sogar detaillierte Studenten zusammen. VdB Neoliberal? Profsiorales Bild? Wer ist dann besser für JG? Griss? Khol? Hundsdorfer? Und wenn sie, wie am Ende des Artikels symbolisiert, lieber einen hätten, dann neugierig, nur wenige Monate vor der Wahl darüber zu lügen.  Wieder ein Beweis für Selbstzerstörung und kontinuierliche Installation der Grünen.",fil
8016,602561,602560.0,7162,2217,2016-01-10 15:39:36.680,online,,"Nur blöd das sich das zweite widerspricht, effektive Grenzsicherung kostet Geld und woher außer von den Sozialleistungen soll das kommen?",0,20,1.0,0.0,0.0,0.0,0.0,0.0,1.0,0.0,0.0,0,Newsroom/Panorama/Gesellschaft/integrationpano,Haslauer will niedrigere Mindestsicherung für Flüchtlinge,2016-01-10 13:22:46.000," Nur zu erhöhen, dass die zweite widersprüchliche, effektive Grenzsicherungskosten des Geldes sind und die, abgesehen von sozialen Vorteilen, von ihnen kommen sollten?",fil
8026,605952,605946.0,7213,26250,2016-01-12 11:54:58.517,online,,Schwachsinn!,0,0,0.0,0.0,1.0,0.0,0.0,0.0,1.0,0.0,0.0,0,Newsroom/Panorama/Flucht/Flucht_und_Politik,Österreich: 90.000 Asylanträge im Jahr 2015,2016-01-12 07:15:27.000, Ungerechtigkeit!,fil
8035,607346,607345.0,7235,28656,2016-01-12 22:38:52.007,online,,"Mei sie Armer, war knapp vor dem Abkratzen ...",0,23,0.0,0.0,1.0,0.0,0.0,0.0,1.0,0.0,0.0,0,Newsroom/Web/Netzpolitik,Zuckerbergs Babyposting entzündet Impfgegner-Debatte,2016-01-12 10:52:53.000," Mei he he arm, ist kurz vor dem Kratzen ...",fil
8069,615368,615367.0,7346,3701,2016-01-15 17:24:27.210,online,,"Psychologen und Lehrer als Eltern... 
Bewahrheitet sich immer wieder",12,1,0.0,0.0,0.0,0.0,0.0,0.0,1.0,0.0,0.0,0,Livingroom/Familie/Kind/Elternblog,"Geschwisterrivalität: Was Eltern tun sollen, wenn Kinder streiten",2016-01-15 10:50:04.000, Psychologen und Lehrer als Eltern...   Wiederholt echt,fil
8079,616098,616094.0,7363,30704,2016-01-16 16:37:08.693,online,,"Nein, natürlich gibt es nicht eine einzig richtige Lebensweise.

ABER wenn man in einem fremden Land aufgenommen wird, muss man nicht meinen dessen Bevölkerung von der eigenen Lebensweise und den eigenen Werten überzeugen zu müssen. 
Genau das passiert doch gerade.

Auf Afrika geh ich nicht näher ein. Da müsste man zu weit ausholen. Ich hoffe nur die Millionen, welche an der Küste warten bleiben uns erspart, so hart es klingt.

Und klar beruht unser Wohlstand auf der Armut der anderen, das hat jedoch jeder selbst in der Hand. Solange man in einen Kik oder Primarkt rennt wird sich das auch nicht ändern.
Ein wenig Eigenverantwortung und Bewusstsein sollte dann schon sein.",0,0,1.0,1.0,0.0,1.0,0.0,0.0,1.0,0.0,0.0,0,Newsroom/International/Afrika/BurkinaFaso,Burkina Faso: Mindestens 23 Tote bei Angriff auf Hotel,2016-01-15 21:53:28.300," Nein, natürlich gibt es keine richtige Lebensweise.    Aber wenn man im Ausland akzeptiert wird, braucht man seine Bevölkerung nicht in Ihrer eigenen Lebensweise und Ihren Werten zu überzeugen.   Das ist genau das, was vor sich geht.    Ich gehe nicht mehr nach Afrika. Man muss zu weit gehen. Ich hoffe, dass Millionen wartender Aliens uns sehr ähnlich wie sein Klang retten werden.    Und es ist klar, dass unser Vorhaben auf der Armut anderer basiert, aber alles liegt in ihren eigenen Händen. Solange man in Kik oder Primarkt läuft, wird sich daran nichts ändern.  Einige persönliche Verantwortung und Bewusstsein sollte immer sein.",fil
8087,619067,619066.0,7401,1795,2016-01-17 16:43:12.867,online,,"Naja, es gibt einige Länder, die verzweifelt am Euro fest halten, koste es (die Bürger), was es wolle :-(",3,3,0.0,0.0,0.0,0.0,0.0,0.0,1.0,0.0,0.0,0,Newsroom/Wirtschaft/Wirtschaftpolitik/Finanzmaerkte,Varoufakis: Eurozone wird auseinanderbrechen,2016-01-17 11:46:27.000," Nun, es gibt einige Länder, die verzweifelt am Euro festhalten wollen und (die Bürger) kosten, was sie wollen :-)",fil
8088,620098,,7408,5229,2016-01-17 19:26:09.803,online,,http://www.krone.at/Oesterreich/Uebergriffe_auf_Justizbeamte_Wir_sind_Freiwild-Gewalt_explodiert-Story-491572,8,0,0.0,0.0,0.0,1.0,0.0,0.0,1.0,0.0,0.0,0,Newsroom/Panorama/Chronik,18-Jährige in Wien vergewaltigt,2016-01-17 15:27:49.000, http://www.krone.at/Oesterreich/Uebergriffe_auf_Justizbeamte_Wir_sind_Freiwild-Gewalt_explodiert-Story-491572,fil
8089,620099,,7408,13173,2016-01-17 20:57:44.633,deleted,,"Da war aber sehr viel Arglosigkeit bei diesem Mädchen dabei...
Hoffentlich ist dieser Vorfall eine WARNUNG für alle Mädchen im Lande!",0,0,0.0,1.0,0.0,1.0,0.0,0.0,1.0,0.0,0.0,0,Newsroom/Panorama/Chronik,18-Jährige in Wien vergewaltigt,2016-01-17 15:27:49.000," Aber es gab eine Menge Arroganz mit dieser Frau ...  Ich hoffe, dass dieses Ereignis eine Warnung für alle Mädchen im Land ist!",fil
8091,620111,620101.0,7408,21204,2016-01-18 10:27:41.067,deleted,lieber Zensi...,"der arme Liftchef hat eine ganz normale Frage gestellt, die Antworten werden aber von euch nicht freigeschalten. Es hagelt aber rote Stricherln. So steht der Fragende als Dummer da, nur weil ihr eine ehrliche Diskussion durch euer Eingreifen verhindert.",0,0,0.0,0.0,1.0,1.0,0.0,1.0,1.0,0.0,0.0,0,Newsroom/Panorama/Chronik,18-Jährige in Wien vergewaltigt,2016-01-17 15:27:49.000,"Liebe Zensi... der arme Chef hat eine normale Frage gestellt, aber die Antworten sind ihnen nicht entsperrt. Aber es erzeugt eine rote Linie. Die Frage steht also als dumme Person, nur weil Man durch sein Eingreifen eine ehrliche Diskussion verhindert.",fil
