,id_post,id_parent_post,id_article,id_user,created_at,status,headline,body,positive_votes,negative_votes,label_argumentsused,label_discriminating,label_inappropriate,label_offtopic,label_personalstories,label_possiblyfeedback,label_sentimentnegative,label_sentimentneutral,label_sentimentpositive,is_staff,article_path,article_title,article_publishing_date,text,lang
5436,247490,,2943,19686,2015-08-28 13:15:37.740,online,"Wann gibts den ersten Politiker/die erste Politikerin,","die aus Prinzip nicht mehr mit der Krone spricht? Das ekelhafte Hetzblatt hat sich schon vollständig als »Nachrichtenmedium« disqualifiziert.

So was muss man nicht zu PKs einladen, sowas muss man keine Interviews geben. Und vor allem muss sich der journalistische Berufsstand sich bei der Nase nehmen und sicherstellen, dass jemand, der auch nur einen Tag dort gearbeitet hat, nie wieder bei einem anderen Medium Arbeit bekommt. Das sind keine KollegInnen!",16,3,0.0,1.0,1.0,0.0,0.0,0.0,1.0,0.0,0.0,0,Newsroom/Etat/PRINT/Mediaprint/krone,"""Krone""-Foto mit toten Flüchtlingen ""unentschuldbar""",2015-08-28 12:42:35.240,"Warum wollen Sie für Ihre Hilfe gerechtigkeitsbedarfhaben, was werden Sie tun? Ich hoffe, wir werden es sein. Ich hoffe, dass es so sein wird. Ich hoffe, dass es dann nicht viel ist, dass ich ihren Sohn liebe.",tlh-Piqd
5493,290992,290984.0,3398,24176,2015-09-10 21:57:03.907,online,,na ich hoffe der ungebremste zuzug von moslems bzw deren einbürgerung wird dann irgendwie erschwert oder gar gestoppt.,10,3,0.0,1.0,0.0,0.0,0.0,0.0,1.0,0.0,0.0,0,Newsroom/Panorama/Flucht/Flucht_und_Politik/europathema,Ungarn winkt Flüchtlinge nach Österreich durch – rund 7.500 am Donnerstag,2015-09-10 17:50:54.840," Und in vielen Zeiten, viele klingonische Flotten und Sätze in einem Tal, dann Phantasien über den Zweck der wilden Luft des Satzes.",tlh-Piqd
5964,318890,318886.0,3650,7263,2015-09-21 00:13:53.707,online,"""Dürfen die Österreicher nicht auch irgendwann sagen dass sie genug haben?""","Wir sind schließlich noch bessere Menschen als es die Deutschen jemals sein werden. 

Darum müssen wir Österreicher pro-Kopf (bis Juni/Juli 2015 an der 3. Stelle pro-Kopf nach Schweden und Malta) auch mehr Flüchtlinge aufnehmen als die ohnehin schon guten Deutschen.

Wir müssen schließlich WILLKOMMENS-KULTUR-WELTMEISTER werden!

Hoffentlich kann unser herzlicher und für alle Flüchtlinge sich erbarmender Faymann bald - und für alle Ewigkeiten - den Willkommens-Kultur-Weltmeister-Nobelpreis entgegennehmen. 

Ich würds ihm von Herzen vergönnen.",3,0,0.0,1.0,1.0,1.0,0.0,0.0,1.0,0.0,0.0,0,Newsroom/Panorama/Flucht/Flucht_und_Politik/europathema,Noch tausend Flüchtlinge am Abend in Nickelsdorf,2015-09-20 19:43:56.000,"""Ich weiß es nicht"", antwortete Cadania, in der Tat, wenn wir Feinde hätten, um mit den Worten der Schwester und der Bibliothek meiner Cousine handeln zu können, mit der Kraft der Worte - für die Phantasie, durch das Recht von Gilgamesch. Oh, guter Romulan, Claudio, Claudio und Claudio, ich habe die gute Frau, gute Margarete, gute Margarete, gute Margarete, meine Herrgehört.",tlh-Piqd
6032,350718,,4082,12197,2015-10-04 20:26:58.747,online,,Schwimmt der auf der anderen Seite des Flußufers? So hört er sich nämlich an...,0,0,0.0,1.0,1.0,1.0,0.0,0.0,1.0,0.0,0.0,0,Newsroom/Web/Webvermischtes,"Österreichischer Youtube-Star: ""Hello friends, ich bin eh ganz normal""",2015-10-04 16:45:09.000," Seine Autorität ist gerne nie Minute? Deshalb, Gottes Wunder.",tlh-Piqd
6096,385218,385217.0,4498,11311,2015-10-17 21:12:53.677,deleted,,"""Frischer Wind in die religöse Ebene""...
Genau darauf kann hundertprozentig verzichtet werden! Über alles andere kann man reden, aber ein Europa, wo in 30 Jahren von jedem Kirchturm ein Muezzin herunterschreit, das brauchen wir ganz sicher nicht! Europäische Religionskriege, Aufklärung und Revolutionen gegen den Feudalismus dürfen nicht umsonst gewesen sein. Es kann einfach nicht sein, dass in Zukunft patriarchalische Hinterwäldler mit mittelalterlichen Gesellschaftsvorstellungen unsere Politik bestimmen! Wenn wir nicht aufpassen, kommt es aber so, siehe Kosovo. Dort leben heute aufgrund ihrer hohen Geburtenrate 90% großteils islamische Albaner und nur noch 7% Serben. Vor 100 Jahren war es genau umgekehrt.",0,0,1.0,1.0,0.0,1.0,0.0,0.0,1.0,0.0,0.0,0,Newsroom/Panorama,Bayern: AfD marschierte an Grenze zu Salzburg auf,2015-10-17 15:10:52.000," ""Leider. bleiben Sie so einfach für ihn! Und alles vorher, in der Tat, und Ohren wurden gemacht, und es war wahrscheinlich Erde. Ein Klingon betrat die englische Bar. Nein, in der Tat, der Geist der klingonischen lustigen Assistenten, in der Tat, der Geist der Feder! Wenn wir Gott haben, dann hatten wir Gott. Gib ihm den Humbaba und sie schicken ihn, um dieses Treffen zu schreiben. Es gibt eine Gruppe von Führern.",tlh-Piqd
8079,616098,616094.0,7363,30704,2016-01-16 16:37:08.693,online,,"Nein, natürlich gibt es nicht eine einzig richtige Lebensweise.

ABER wenn man in einem fremden Land aufgenommen wird, muss man nicht meinen dessen Bevölkerung von der eigenen Lebensweise und den eigenen Werten überzeugen zu müssen. 
Genau das passiert doch gerade.

Auf Afrika geh ich nicht näher ein. Da müsste man zu weit ausholen. Ich hoffe nur die Millionen, welche an der Küste warten bleiben uns erspart, so hart es klingt.

Und klar beruht unser Wohlstand auf der Armut der anderen, das hat jedoch jeder selbst in der Hand. Solange man in einen Kik oder Primarkt rennt wird sich das auch nicht ändern.
Ein wenig Eigenverantwortung und Bewusstsein sollte dann schon sein.",0,0,1.0,1.0,0.0,1.0,0.0,0.0,1.0,0.0,0.0,0,Newsroom/International/Afrika/BurkinaFaso,Burkina Faso: Mindestens 23 Tote bei Angriff auf Hotel,2016-01-15 21:53:28.300," Die einzige Schwester ist nur eine Konstante ... aber hast du nicht genug von deinem Leben... so verdammt in der Tat, aber ich werde damit gehen. Ich werde es in der Tat haben, hast du in der Tat nicht den Rest meines Lebens?    Aber die vermeintliche Leidenschaft für ein langfristiges Überleben von ein paar Minuten, die vermeintlichen Passionswälder.",tlh-Piqd
8089,620099,,7408,13173,2016-01-17 20:57:44.633,deleted,,"Da war aber sehr viel Arglosigkeit bei diesem Mädchen dabei...
Hoffentlich ist dieser Vorfall eine WARNUNG für alle Mädchen im Lande!",0,0,0.0,1.0,0.0,1.0,0.0,0.0,1.0,0.0,0.0,0,Newsroom/Panorama/Chronik,18-Jährige in Wien vergewaltigt,2016-01-17 15:27:49.000, Aber es gibt große Liebe in unseren Herzen. Diese Krieger sind immer lang!,tlh-Piqd
8144,646029,646016.0,7671,27532,2016-01-26 07:21:11.283,online,,"Wer die Postings hier liest, weiß, dass wir auch wieder kurz vor 1938 stehen.",0,2,0.0,1.0,1.0,1.0,0.0,0.0,1.0,0.0,0.0,0,Newsroom/International/Asien/Afghanistan,"""Die Ideologie des IS hat in Afghanistan tiefe Wurzeln""",2016-01-25 13:02:00.000, Die klingonischen Krieger sind willkommen.,tlh-Piqd
8324,734650,,8777,16183,2016-02-26 04:39:46.010,online,,"Wenn in Schweden 10 Mal mehr Frauen vergewaltigt werden als in allen anderen europaeischen Laendern, und die Taeter zu 90% dem arabisch-islamischen Kulturkreis entstammen, bin ich dann ein Hetzer, wenn ich mir erlaube, diese Tatsache vorzubringen? 

Diese Zahlen, die in Schweden immer unter den Tisch gekehrt wurden, kommen jetzt nach Koeln alle ans Tageslicht und ich finde sie erschuetternd!

So kann das doch nicht weiter gehen!",4,0,1.0,1.0,0.0,0.0,0.0,0.0,1.0,0.0,0.0,0,Newsroom/Inland/Sachpolitik/integrationpolitik,Asylwerber in Wien sind gefangen zwischen den Welten,2016-02-25 09:39:14.000," Wenn dies nicht davon geteilt werden kann, wenn es ein schönes Auge gibt?     Klingonische Empire ist klar, aber, nichts, Bildschirme, oder Bildschirme, Bildschirme und Flotten und klar, keine, ich werde klar sein!    Sagen Sie nichts!",tlh-Piqd
8432,777228,,9243,19907,2016-03-09 17:08:52.240,online,,"Es bleibt zu hoffen, das keine westliche Großmacht versucht Nordkorea die Demokratie zu bringen.
Ansonsten befürchte ich, das die ""next Gen"" Halsabschneider in 10 - 15 Jahren aus Koreanern mit Migrationshintergrund bestehen werden ...",1,7,0.0,1.0,0.0,0.0,0.0,0.0,1.0,0.0,0.0,0,Newsroom/International/Asien/Koreakrise/Nordkorea,Nun droht Kim mit Mini-Atomsprengköpfen,2016-03-09 10:59:43.000," Ich wusste, dass es eine süße Ehre war, da es ein klingonisches Opfer war"", fügte er hinzu.",tlh-Piqd
8458,789704,,9401,7448,2016-03-15 08:53:11.497,deleted,,"Den Hellenen ist das doch nur recht! Können sie sich schön abputzen und unsere Knete kassieren, obwohl sie niemanden versorgen. Das sind echt durchtriebene Typen.",4,1,0.0,1.0,0.0,0.0,0.0,0.0,1.0,0.0,0.0,0,Newsroom/Panorama/Flucht/Fluchtgeschichten,"Flüchtlinge verlassen Idomeni – Athen: ""Organisierte Flugblattaktion""",2016-03-14 14:46:57.770, Hier! Zum Ärger der Partei und der Jäger in meinen Augen; diese Idee geht weg.,tlh-Piqd
8490,800467,,9574,12263,2016-03-18 13:49:06.493,online,Unsinn,"Ähnlichkeiten gibt es immer und zu allem. Damals hatte man die heutigen Erfahrungen nicht. Den Pöbel gibt es klarerweise immer noch. Aber auch viel mehr Wissende und Vernünftige. Natürlich nicht am Balkan, aber im Westen.  Und dieser bestimmt die Geschehnisse im Rest der Welt, zum Glück.",0,3,1.0,1.0,1.0,0.0,0.0,0.0,1.0,0.0,0.0,0,Newsroom/International,"Kriegsforscherin: ""Die Welt bewegt sich zurück zur Unordnung""",2016-03-18 05:30:00.000,"Dein Vater hat deinen Cousin getan, und dein Vater ist gestorben, Der Kapitän ist in diesem. und der Wunsch, das kleine Kapital zu verstehen, ohne die tiefe genug seines Bruders... aber jetzt, im Rasseln der Karriere, jetzt in den letzten Ehren, jetzt in einem verstörenden Schauspieler.",tlh-Piqd
8493,801001,801000.0,9589,947,2016-03-18 18:42:24.083,online,,"Ich hatte während meiner Schulzeit vor zig-Jahren einige muslimische Mitschüler, diese unterschieden sich in nichts von uns. Sie waren angezogen wie wir, sprachen perfekt Deutsch, waren sehr gute Schüler, wir  haben uns alle sehr gut mit ihnen vertragen, es gab nie ein Problem! Und das sage ich nicht nur aus heutiger Sicht. Die ""neuen"" Muslime haben das alles nicht mehr nötig: sie lernen weder Deutsch noch sonst was in der Schule, stören den Unterricht, behandeln LehrerINNEN respektlos, Lehrer genauso, verhalten sich gegenüber Österreichern oft frech (aus mangelndem Selbstbewusstsein) usw. Also von einem unbegründetem Rassismus kann wohl keine Rede sein. Wen wundert das?",26,0,1.0,1.0,0.0,0.0,0.0,0.0,1.0,0.0,0.0,0,Newsroom/Inland/Sachpolitik/ipokirche,Feindbild Muslime als europaweites Phänomen,2016-03-18 18:01:19.000," Ich hoffe, dass ich rechtzeitig zu unserem Mund hoffe, dass wir uns zu allen Zeiten tun werden,"" Ich würde nicht bleiben, um die Nacht von uns zu haben. ""Buffalo Türen, und die schreckliche Seite der Luft darf eifrig zu beenden, die Engländer noch kann sie verstehen, fast alle Leben, die Terrans dürfen schrecklich beendet werden ... Was wird beginnen zu quietschen?",tlh-Piqd
8549,823426,,9879,7721,2016-03-29 12:12:00.747,online,,"Irgendwo habe ich gelesen, dass das Model ihn auch frisiert. Vor ein paar hundert Jahren hat man solche Frauen verbrannt.",0,0,0.0,1.0,1.0,0.0,0.0,0.0,1.0,0.0,0.0,0,Meinung/Kolumnen/rau,The next First Lady,2016-03-28 17:55:34.140," Ich weiß nicht, wie Musik es ist. Ich kann mir kein bisschen Winkel verschaffen.",tlh-Piqd
8694,889641,,10600,5914,2016-04-18 19:50:08.723,online,Dieser Mensch mag die Menschen nicht,"Wenn man sich selbst als Elite sieht (Burschenschafter-Denken), dann teilt man die ""Untermenschen"" unter sich halt gern in Gut und Böse auf.

Muss jeder selbst wissen, ob man jemanden wählen will - der offensichtlich keine Menschen mag.",19,2,0.0,1.0,0.0,0.0,0.0,0.0,1.0,0.0,0.0,0,Newsroom/Inland/bundespraesi,Hofer: AMS soll Migranten keine Jobs vermitteln,2016-04-18 16:29:51.000,"Die klingonische Flotte war ungestört, dass der Kadanianer nicht begründet worden war, und die Hunde waren sehr wenige gründlich.",tlh-Piqd
8754,923281,,10994,12110,2016-04-29 08:40:15.217,online,,"Die Flüchtlinge wissen genau, was sie vom Gastgeberland erwarten. Die sind in diesem Punk knallhart, so meine eigene persönliche Erfahrung.",32,0,0.0,1.0,0.0,0.0,0.0,0.0,0.0,1.0,0.0,0,Newsroom/Panorama/Flucht/Flucht_und_Politik,Kurz verteidigt mögliche Grenzkontrollen am Brenner,2016-04-29 05:35:34.000," Es gab viele Dornen, die verdammt worden waren, und bremsten die Wälder der Angelegenheiten der Angelegenheiten.",tlh-Piqd
8943,991168,,11892,28609,2016-05-25 22:15:02.737,online,"Verteidiger Wolfgang Blaschitz hatte auf den nun ordentlichen Lebenswandel seines Mandanten, der im Juni zum zweiten Mal Vater wird, verwiesen","Und dann zum dritten, vierten, fünften ... Mal.",5,2,0.0,1.0,0.0,0.0,0.0,0.0,1.0,0.0,0.0,0,Newsroom/Panorama/Chronik,Teilbedingte Haft für mutmaßlichen Syrien-Kämpfer in Krems,2016-05-25 18:27:16.000,"4:32 Und diese Dinge sind so sehr im Herrn, wie der Fürst, morgen, der Herr glücklich morgen, dass der Herr glücklich morgen viele Dinge zu morgen erleiden würde.",tlh-Piqd
3626,27821,27820.0,447,3112,2015-06-11 18:08:32.163,deleted,,"erstens ist die Zahl erfunden, und selbst wenn..., wenn deren kultureller Hintergrund der ""anatolische Islam"" gewesen wäre, dann wärs nix mit Gleichberechtigung zw. Mann und Frau, nix mit Life Ball, Conchita Wurst usw. ums mal so zu formulieren",5,1,0.0,1.0,0.0,0.0,0.0,0.0,1.0,0.0,0.0,0,Newsroom/Panorama/Gesellschaft/demografischerwandel,Österreichs Bevölkerung wuchs im Vorjahr um 77.000 Menschen,2015-06-11 13:01:46.000," Erstens wurde die Zahl erfunden, und obwohl ... wenn ihr kultureller Hintergrund ""anatolischer Islam"" gewesen wäre, dann gäbe es nichts Gleiches zwischen Männern und Frauen, nichts mit Life Ball, Conchita Wurst, etc., um es so zu sagen.",th
4463,77217,77211.0,1178,28291,2015-09-07 20:45:29.993,online,"vor aölem nach den müllbergen am wochenende, die die gemeinde von den türken dann auf gemeindekosten entsorgen darf..",,2,0,0.0,1.0,0.0,0.0,0.0,0.0,1.0,0.0,0.0,0,daStandard/daAlltag,"""Verschmutzte Parks, laute Kinder, Ausländer""",2015-06-30 21:11:04.000,"Vor aölem, nach einem Berg von Müll über das Wochenende, die die Gemeinde von den Türken auf Kosten der Gemeinde beseitigen kann. ",th
5075,148473,,1924,27712,2015-07-25 00:32:56.873,online,"Hallo Thomas,","ich mache Dich darauf aufmerksam, daß Du hier in Gutmenschen-Forum unterwegs bist! Hier gibt's keine Gnade!",1,8,0.0,1.0,1.0,1.0,0.0,0.0,1.0,0.0,0.0,0,Newsroom/Web/Netzpolitik/Hasspostings,Porsche entlässt Lehrling nach Hassposting auf Facebook,2015-07-24 11:09:44.000,"Hallo Thomas, ich möchte Ihre Aufmerksamkeit auf die Tatsache lenken, dass Sie hier im Gutmenschen-Forum sind!",th
5434,246926,246925.0,2928,5179,2015-08-27 17:08:08.170,online,,Hat der Fahrer von jedem vermuteten Flüchtling 10.000 Euro erhalten?,0,0,0.0,1.0,0.0,0.0,0.0,0.0,1.0,0.0,0.0,0,Meinung/Kommentare/FoederlSchmid,Die EU kann etwas gegen Schlepper tun,2015-08-27 16:02:49.000, Hat der Fahrer von jedem mutmaßlichen Flüchtling 10.000 Euro erhalten?,th
5436,247490,,2943,19686,2015-08-28 13:15:37.740,online,"Wann gibts den ersten Politiker/die erste Politikerin,","die aus Prinzip nicht mehr mit der Krone spricht? Das ekelhafte Hetzblatt hat sich schon vollständig als »Nachrichtenmedium« disqualifiziert.

So was muss man nicht zu PKs einladen, sowas muss man keine Interviews geben. Und vor allem muss sich der journalistische Berufsstand sich bei der Nase nehmen und sicherstellen, dass jemand, der auch nur einen Tag dort gearbeitet hat, nie wieder bei einem anderen Medium Arbeit bekommt. Das sind keine KollegInnen!",16,3,0.0,1.0,1.0,0.0,0.0,0.0,1.0,0.0,0.0,0,Newsroom/Etat/PRINT/Mediaprint/krone,"""Krone""-Foto mit toten Flüchtlingen ""unentschuldbar""",2015-08-28 12:42:35.240,"Wann wird der erste Politiker grundsätzlich nicht mehr zur Krone sprechen? Ekelhafter Hass hat sich als ""Nachrichtenmedium"" völlig disqualifiziert, man muss dich nicht zu solchen PKs einladen, man muss solche Interviews nicht geben, und vor allem muss der Journalismusberuf auf sich selbst schauen und dafür sorgen, dass die Leute, die dort arbeiten, auch nur eines Tages nie für andere Medien arbeiten. Das ist kein Kollege!",th
5493,290992,290984.0,3398,24176,2015-09-10 21:57:03.907,online,,na ich hoffe der ungebremste zuzug von moslems bzw deren einbürgerung wird dann irgendwie erschwert oder gar gestoppt.,10,3,0.0,1.0,0.0,0.0,0.0,0.0,1.0,0.0,0.0,0,Newsroom/Panorama/Flucht/Flucht_und_Politik/europathema,Ungarn winkt Flüchtlinge nach Österreich durch – rund 7.500 am Donnerstag,2015-09-10 17:50:54.840," Ich hoffe, dass der Zustrom von Muslimen oder ihre Einbürgerung es schwieriger machen oder stoppen wird.",th
5964,318890,318886.0,3650,7263,2015-09-21 00:13:53.707,online,"""Dürfen die Österreicher nicht auch irgendwann sagen dass sie genug haben?""","Wir sind schließlich noch bessere Menschen als es die Deutschen jemals sein werden. 

Darum müssen wir Österreicher pro-Kopf (bis Juni/Juli 2015 an der 3. Stelle pro-Kopf nach Schweden und Malta) auch mehr Flüchtlinge aufnehmen als die ohnehin schon guten Deutschen.

Wir müssen schließlich WILLKOMMENS-KULTUR-WELTMEISTER werden!

Hoffentlich kann unser herzlicher und für alle Flüchtlinge sich erbarmender Faymann bald - und für alle Ewigkeiten - den Willkommens-Kultur-Weltmeister-Nobelpreis entgegennehmen. 

Ich würds ihm von Herzen vergönnen.",3,0,0.0,1.0,1.0,1.0,0.0,0.0,1.0,0.0,0.0,0,Newsroom/Panorama/Flucht/Flucht_und_Politik/europathema,Noch tausend Flüchtlinge am Abend in Nickelsdorf,2015-09-20 19:43:56.000,"""Die Österreicher können nicht irgendwann sagen, dass sie genug haben?"" Schließlich sind wir bessere Menschen als die Deutschen, deshalb sind wir Österreicher pro Kopf (bis Juni/Juli 2015 auf Platz 3 pro Kopf nach Schweden und Malta). Es werden immer noch mehr Flüchtlinge gebraucht als gute Deutsche.    Schließlich müssen wir die Weltmeister der Kultur willkommen werden!     Ich werde ihm sein Herz geben.",th
6032,350718,,4082,12197,2015-10-04 20:26:58.747,online,,Schwimmt der auf der anderen Seite des Flußufers? So hört er sich nämlich an...,0,0,0.0,1.0,1.0,1.0,0.0,0.0,1.0,0.0,0.0,0,Newsroom/Web/Webvermischtes,"Österreichischer Youtube-Star: ""Hello friends, ich bin eh ganz normal""",2015-10-04 16:45:09.000, Schwimmt er auf der anderen Seite des Flusses? Er klingt wie...,th
6096,385218,385217.0,4498,11311,2015-10-17 21:12:53.677,deleted,,"""Frischer Wind in die religöse Ebene""...
Genau darauf kann hundertprozentig verzichtet werden! Über alles andere kann man reden, aber ein Europa, wo in 30 Jahren von jedem Kirchturm ein Muezzin herunterschreit, das brauchen wir ganz sicher nicht! Europäische Religionskriege, Aufklärung und Revolutionen gegen den Feudalismus dürfen nicht umsonst gewesen sein. Es kann einfach nicht sein, dass in Zukunft patriarchalische Hinterwäldler mit mittelalterlichen Gesellschaftsvorstellungen unsere Politik bestimmen! Wenn wir nicht aufpassen, kommt es aber so, siehe Kosovo. Dort leben heute aufgrund ihrer hohen Geburtenrate 90% großteils islamische Albaner und nur noch 7% Serben. Vor 100 Jahren war es genau umgekehrt.",0,0,1.0,1.0,0.0,1.0,0.0,0.0,1.0,0.0,0.0,0,Newsroom/Panorama,Bayern: AfD marschierte an Grenze zu Salzburg auf,2015-10-17 15:10:52.000," ""Eine erfrischende Brise in die religiösen Ebenen""...  Wir können über alles andere reden, aber natürlich brauchen wir kein Europa, in dem in 30 Jahren Muezzin von jedem Kirchturm herabschreit! Europas Religionskriege, Aufklärung und antifeudale Revolutionen dürfen nicht umsonst sein. Wenn wir jedoch nicht aufpassen, wird es passieren, dass der Kosovo, da seine hohe Geburtenrate 90 % der islamischen Albaner beträgt, und nur 7 % der Serben heute dort leben.",th
8079,616098,616094.0,7363,30704,2016-01-16 16:37:08.693,online,,"Nein, natürlich gibt es nicht eine einzig richtige Lebensweise.

ABER wenn man in einem fremden Land aufgenommen wird, muss man nicht meinen dessen Bevölkerung von der eigenen Lebensweise und den eigenen Werten überzeugen zu müssen. 
Genau das passiert doch gerade.

Auf Afrika geh ich nicht näher ein. Da müsste man zu weit ausholen. Ich hoffe nur die Millionen, welche an der Küste warten bleiben uns erspart, so hart es klingt.

Und klar beruht unser Wohlstand auf der Armut der anderen, das hat jedoch jeder selbst in der Hand. Solange man in einen Kik oder Primarkt rennt wird sich das auch nicht ändern.
Ein wenig Eigenverantwortung und Bewusstsein sollte dann schon sein.",0,0,1.0,1.0,0.0,1.0,0.0,0.0,1.0,0.0,0.0,0,Newsroom/International/Afrika/BurkinaFaso,Burkina Faso: Mindestens 23 Tote bei Angriff auf Hotel,2016-01-15 21:53:28.300," Natürlich gibt es keine richtige Lebensweise, aber wenn man akzeptiert wird, im Ausland zu leben, braucht man die Bevölkerung nicht von seiner eigenen Lebensweise und ihren Werten zu überzeugen.   Das ist es, was passiert.    Ich gehe nicht mehr nach Afrika. Man muss zu weit gehen. Ich hoffe nur, dass die Millionen von Menschen, die an der Küste warten, unser Leben so hart halten werden, wie sie denken, und natürlich hängt unser Wohlstand von der Armut anderer ab. Aber jeder hat es selbst in der Hand, solange man auf einen Gig oder Primarkt läuft, wird sich das nicht ändern.  Persönliche Verantwortung und ein wenig Bewusstsein sollten bereits sein.",th
8089,620099,,7408,13173,2016-01-17 20:57:44.633,deleted,,"Da war aber sehr viel Arglosigkeit bei diesem Mädchen dabei...
Hoffentlich ist dieser Vorfall eine WARNUNG für alle Mädchen im Lande!",0,0,0.0,1.0,0.0,1.0,0.0,0.0,1.0,0.0,0.0,0,Newsroom/Panorama/Chronik,18-Jährige in Wien vergewaltigt,2016-01-17 15:27:49.000, Hoffentlich ist dieses Ereignis eine Warnung an alle Mädchen im Land!,th
8144,646029,646016.0,7671,27532,2016-01-26 07:21:11.283,online,,"Wer die Postings hier liest, weiß, dass wir auch wieder kurz vor 1938 stehen.",0,2,0.0,1.0,1.0,1.0,0.0,0.0,1.0,0.0,0.0,0,Newsroom/International/Asien/Afghanistan,"""Die Ideologie des IS hat in Afghanistan tiefe Wurzeln""",2016-01-25 13:02:00.000," Jeder, der den Beitrag hier liest, kennt uns wieder, als er sich 1938 nähert.",th
8324,734650,,8777,16183,2016-02-26 04:39:46.010,online,,"Wenn in Schweden 10 Mal mehr Frauen vergewaltigt werden als in allen anderen europaeischen Laendern, und die Taeter zu 90% dem arabisch-islamischen Kulturkreis entstammen, bin ich dann ein Hetzer, wenn ich mir erlaube, diese Tatsache vorzubringen? 

Diese Zahlen, die in Schweden immer unter den Tisch gekehrt wurden, kommen jetzt nach Koeln alle ans Tageslicht und ich finde sie erschuetternd!

So kann das doch nicht weiter gehen!",4,0,1.0,1.0,0.0,0.0,0.0,0.0,1.0,0.0,0.0,0,Newsroom/Inland/Sachpolitik/integrationpolitik,Asylwerber in Wien sind gefangen zwischen den Welten,2016-02-25 09:39:14.000," Wenn Frauen in Schweden zehnmal mehr vergewaltigt werden als jedes andere europäische Land, und 90 % der Taeters aus der arabisch-islamischen Kultur stammen, hasse ich es, wenn ich mir das erlaubt?     Diese Zahlen, die in Schweden schon immer unter den Tisch gekehrt wurden, kommen nun alle nach Koeln ans Licht und ich finde sie bis vorwegzunehmen!",th
8432,777228,,9243,19907,2016-03-09 17:08:52.240,online,,"Es bleibt zu hoffen, das keine westliche Großmacht versucht Nordkorea die Demokratie zu bringen.
Ansonsten befürchte ich, das die ""next Gen"" Halsabschneider in 10 - 15 Jahren aus Koreanern mit Migrationshintergrund bestehen werden ...",1,7,0.0,1.0,0.0,0.0,0.0,0.0,1.0,0.0,0.0,0,Newsroom/International/Asien/Koreakrise/Nordkorea,Nun droht Kim mit Mini-Atomsprengköpfen,2016-03-09 10:59:43.000," Hoffen wir, dass keine westliche Supermacht versucht, Nordkorea Demokratie zu bringen.  Ansonsten fürchte ich, dass der Kehlkopfschneider der ""nächsten Generation"" in 10 bis 15 Jahren aus Koreanern mit Migrationshintergrund bestehen wird.",th
8458,789704,,9401,7448,2016-03-15 08:53:11.497,deleted,,"Den Hellenen ist das doch nur recht! Können sie sich schön abputzen und unsere Knete kassieren, obwohl sie niemanden versorgen. Das sind echt durchtriebene Typen.",4,1,0.0,1.0,0.0,0.0,0.0,0.0,1.0,0.0,0.0,0,Newsroom/Panorama/Flucht/Fluchtgeschichten,"Flüchtlinge verlassen Idomeni – Athen: ""Organisierte Flugblattaktion""",2016-03-14 14:46:57.770," Hellen ist das einzige Recht! Sie können sich gut reinigen und unsere Massagen sammeln, auch wenn sie niemanden versorgen. Das sind echte Passanten.",th
8490,800467,,9574,12263,2016-03-18 13:49:06.493,online,Unsinn,"Ähnlichkeiten gibt es immer und zu allem. Damals hatte man die heutigen Erfahrungen nicht. Den Pöbel gibt es klarerweise immer noch. Aber auch viel mehr Wissende und Vernünftige. Natürlich nicht am Balkan, aber im Westen.  Und dieser bestimmt die Geschehnisse im Rest der Welt, zum Glück.",0,3,1.0,1.0,1.0,0.0,0.0,0.0,1.0,0.0,0.0,0,Newsroom/International,"Kriegsforscherin: ""Die Welt bewegt sich zurück zur Unordnung""",2016-03-18 05:30:00.000,"Es gibt immer und jeden, um zu wissen, was vor sich geht. Offensichtlich existiert der Mob immer noch, aber auch sachkundiger und vernünftiger, nicht auf dem Balkan, sondern im Westen, und das bestimmt, was im Rest der Welt geschieht.",th
