,id_post,id_parent_post,id_article,id_user,created_at,status,headline,body,positive_votes,negative_votes,label_argumentsused,label_discriminating,label_inappropriate,label_offtopic,label_personalstories,label_possiblyfeedback,label_sentimentnegative,label_sentimentneutral,label_sentimentpositive,is_staff,article_path,article_title,article_publishing_date,text,lang
7543,513868,,6070,2373,2015-12-03 19:49:13.193,online,,"S.g. Herr Völker. Es ist nicht erkennbar, was Sie mit diesen Zeilen überhaupt sagen möchten, ich vermute, dass Sie es selbst nicht wissen. Sie werfen einem Politiker vor, dass er einen Missstand zu seinem politischen Vorteil nützt, mit Hingabe auf einer Welle reitet und Aufmerksamkeit generiert. Was bitte ist schlecht daran? Und wenn er diese Sache für seinen eigenen Erfolg benützt, was bitte ist schlecht daran?",2,5,1.0,0.0,0.0,0.0,0.0,1.0,1.0,0.0,0.0,0,Meinung/Kommentare/Voelker,Gleichberechtigt euch!,2015-12-03 16:58:48.000," S.G. Herr Völker. Es ist nicht klar, was Sie mit diesen Zeilen sagen wollen, ich vermute, Sie kennen sich selbst nicht. Sie werfen einem Politiker vor, die Trauer für seinen politischen Gewinn zu nutzen, die Welle mit Hingabe zu reiten und Aufmerksamkeit zu schaffen. Was ist daran falsch, bitte? Und wenn er dieses Ding zu seinem Erfolg nutzt, was ist das Schlimmste daran, bitte?",kn
7544,514540,514539.0,6078,12318,2015-12-04 07:06:46.773,online,,"Sozialistenumtriebe? Die Partei mit ""Wirtschaftskompetenz"" ist seit 1984 (?) ununterbrochen in der Regierung.

Nein, nein, die ÖVP hat da mindestens den gleichen Anteil daran - vor allem in Sachen Innovationsfeinslichkeit und Bildungsbremse.",22,2,1.0,0.0,0.0,0.0,0.0,0.0,1.0,0.0,0.0,0,Newsroom/Wirtschaft/Wirtschaftpolitik/Arbeitsmarkt,Ökonomen haben Angst vor dauerhafter Jobkrise in Österreich,2015-12-04 05:30:00.000," Sozialistische Tendenzen? Eine Partei mit ""wirtschaftlichem Potenzial"" ist seit 1984 ununterbrochen an der Regierung (?).    Nein, nein, die ÖVP hat zumindest den gleichen Anteil daran - vor allem in Bezug auf die Sensibilität der Innovation und den Bildungsbruch.",kn
7549,517347,517346.0,6106,30652,2015-12-04 16:49:41.680,online,,Oder meinst du ab hinter den Zaun?,0,0,0.0,0.0,0.0,0.0,0.0,0.0,1.0,0.0,0.0,0,Newsroom/Etat/PRINT,"""Kurier""-Fotocausa: Gudenus spendet für Flüchtlinge",2015-12-04 14:16:42.000," Oder bedeutet es, dass Sie hinter den Zaun zurückkehren?",kn
7559,520617,520616.0,6157,23608,2015-12-06 20:10:35.897,online,,lernens amoi die grammatik verdammt nommoi!,0,4,0.0,0.0,1.0,1.0,0.0,0.0,1.0,0.0,0.0,0,Newsroom/Inland/Bildung/Schueler/schuelerreligion,Krach um Kindergärten im Zeichen des Korans,2015-12-06 17:56:54.000, Lernen Sie Amoi Grammar Dum Nommoy!,kn
7562,525383,525382.0,6194,9008,2015-12-07 19:26:38.377,online,Wer schafft denn Arbeitsplätze?,"Gewerkschafts- oder Kammerfunktionäre?

Soziologie-Experten?

NGO-Keiler?

Wer?

???",13,4,0.0,0.0,0.0,0.0,0.0,0.0,1.0,0.0,0.0,0,Newsroom/Wirtschaft/Finanzen/Portfoliowirtschaft,"Vermögensforscher: ""Reiche sollten sich nicht isolieren""",2015-12-07 18:33:38.000,Wer schafft Arbeitsplätze? Gewerkschafts- oder Kammerfunktionäre?    Soziologie-Experten?    NGO Keile?    Wer?    ???,kn
7572,531051,531050.0,6284,25440,2015-12-10 11:33:18.937,online,,"bitte, bitte tuns ma keine probleme für frau w. machen.
die gehört doch zur familie, zum clan.
wer eines der mitglieder angreift, greift den häuptling an, den herrn h. und im falle der frau w. auch den herrn s., einen zwar aalglatten aber trotzdem unfähigen rotgefärbten schwarzen, der bei jeder pressekonferenz ausschaut, als hätte er sich im saal geirrt. einem fachmann für rein gar nix ausser unverbindlich plauschen.
nein, die können keine fehler machen.
alle ist gut und wird gut. glaubens ma das.
bei meiner ehr und meinem fluchtachterl.",1,0,0.0,0.0,1.0,1.0,0.0,0.0,1.0,0.0,0.0,0,Newsroom/Panorama/Gesellschaft/integrationpano,Wien: Religionsleitfaden für Kindergärten kommt,2015-12-09 18:10:05.000," Bitte machen Sie keine Probleme für die Frau.  Es gehört der Familie, dem Clan.  Wer eines der Mitglieder angreift, ist ein aalglattes, aber inkompetentes Rot-Schwarz im Fall des Häuptlings, Lord H. und der Frau, der jede Pressekonferenz so sieht, als wäre sie falsch im Saal. Ein Experte, der nichts anderes als ein unbesinen Chat ist.  Nein, sie können keine Fehler machen.  Alles ist gut und gut. Ma glauben Es.  Zu meiner Ehre und meinem Fluch Achter.",kn
7581,533964,533955.0,6322,23560,2015-12-11 11:18:49.110,online,,Und so? Tut es das schon ab 1.1.2016. Intelligente Lösung.,0,0,0.0,0.0,0.0,0.0,0.0,0.0,1.0,0.0,0.0,0,Newsroom/User/mitmachen,Grunderwerbsteuer: Vererben oder verschenken?,2015-12-11 05:30:00.000, Also? Sie wird dies bereits am 1.1.2016 tun. Weise Lösung.,kn
7587,535326,535324.0,6355,18850,2015-12-12 07:21:42.260,online,,Nur wenn es was zu raunzen gibt.  Perfekt.,6,0,0.0,0.0,0.0,1.0,0.0,0.0,1.0,0.0,0.0,0,Newsroom/Panorama/Chronik/Verkehrssache/oeffentlicher_verkehr,Neuer ÖBB-Fahrplan ändert Pendlerströme durch Wien,2015-12-11 17:49:16.000, Nur wenn Ram etwas hat.  perfekt.,kn
7594,538296,,6393,30950,2015-12-13 16:38:44.087,online,,"Cool. So kommt man schnell und billig zu den Volltrotteln. Nur so weiter...
Wie deppert geht's eigentlich noch???",12,0,0.0,0.0,1.0,0.0,0.0,0.0,1.0,0.0,0.0,0,Newsroom/Web/Netzpolitik,"Karlskirche: Fremdenfeinde wollen ""Moschee am Karlsplatz"" abreißen",2015-12-13 12:11:16.000, Cool. So gehen Sie volle Trabe schnell und billig. Sowie...  Wie viel mehr ist möglich???,kn
7615,548198,,6502,9343,2015-12-16 18:51:13.703,online,Terror,"Warum und weshalb, sollte die Türkei eine Organisation keinen Halt bieten dürfen? 

Nur weil die sich in Zivil bzw. in Frauenkleidung mit Kopfbedeckung sich verstecken und Granaten auf die Polizisten feuern, dürfen die Sicherheitsbehörden sich töten lassen! Na dann ist es ja kein Problem, demnächst ist das Problem sowieso erledigt von euer Seiten aus, weil ihr 
tun und lassen könnt was ihr wollt! Schulen usw. die Kinder nicht besuchen lassen, aber sich ärgern, wenn der Staat die Lehrer zurück ordert, ärgert ihr euch! Geld für Strom, Gas usw.  ""Nein Zahlt ihr Nicht"" weil ihr die Kurden die auserwählten dieser Welt seit, wenn ihr in Europa was schlechtes anrichtet seit ihr sowieso Türken und verdreckt euren Namen nicht!!",4,27,0.0,0.0,0.0,0.0,0.0,0.0,1.0,0.0,0.0,0,Newsroom/International/Europa/Tuerkei,Furcht vor Bürgerkrieg in der Südosttürkei,2015-12-16 16:43:42.000,"Warum und warum darf der Terrorismus die Organisation nicht aufhalten?     Diejenigen mit Helmen in Zivil- oder Frauenkleidung und Feuergranaten auf Polizisten, Sicherheitsbeamte dürfen getötet werden! Nun, dann ist dies kein Problem, bald wird das Problem auf Ihrer Seite sowieso sein, weil Sie tun und alles lassen können! Schulen usw. lassen Kinder nicht besuchen, aber es wird ärgerlich, wenn der Staat den Lehrer zurückordnet, wirst du wütend! Geld für Strom, Gas usw.  ""Nein, du zahlst nicht"", weil du die Kurden der auserwählten Welt bist, wenn du in Europa Böses tust, weil du sowieso ein Türke bist und deinen Namen nicht ruinierst!!",kn
7620,549211,,6517,25383,2015-12-17 12:46:45.060,online,Einer Leiche den Titel aus den toten Händen reißen.,"Seine Forschungen waren nicht nur bekannt sondern auch Grundlage der Ehrung. Wenn man rückblickend ein Problem damit hat, dann sollte man vielleicht erst die Ehrenden und die Folgen ihrer Handlungen genauer anschauen, bevor man meint es wäre mit einer posthumen Titelaberkennung einfach so erledigt.",15,12,1.0,0.0,0.0,0.0,0.0,0.0,1.0,0.0,0.0,0,Newsroom/Inland/Bildung/uni,Uni Salzburg widerruft Ehrendoktorat für Konrad Lorenz,2015-12-17 10:37:12.000,"Reißen Sie den Titel mit den toten Händen der Leiche. Seine Forschung war nicht nur bekannt, sondern auch die Grundlage des Respekts. Im Nachhinein, wenn Sie ein Problem damit haben, sollten Sie vielleicht zuerst genau auf die Folgen ihrer Handlungen schauen, bevor Sie denken, dass es mit dem posthumen Titelentzug getan wird.",kn
7873,552202,552195.0,6566,2189,2015-12-18 16:18:34.193,online,Laut schreien,"und nix wissen...
Die Regelung ist bei uns viel schärfer als in UK. Und trotzdem konform mit EU-Recht.
Kurz gefasst: der dich so empörende Fall ist unmöglich.",2,0,1.0,0.0,1.0,0.0,0.0,0.0,1.0,0.0,0.0,0,Newsroom/International/Europa/Grossbritannien,Brexit: Cameron hält an Einschränkung von Sozialleistungen fest,2015-12-18 14:51:44.760,"Schreien laut und nichts wissen...  Die Regulierung ist für uns viel strenger als für das Vereinigte Königreich. Sie steht jedoch im Einklang mit dem EU-Recht.  Kurz gesagt, Sie finden einen sehr skandalösen Fall unmöglich.",kn
7875,553428,553425.0,6578,1140,2015-12-18 22:58:37.640,online,,"Vorallem das Sonnwendviertel, zerstört die gewachsene Grätzlstruktur der Kreta - furchtbar!",1,0,0.0,0.0,0.0,1.0,0.0,0.0,1.0,0.0,0.0,0,Newsroom/Panorama/wien,Die Wiener fühlen sich ziemlich sicher,2015-12-18 17:53:40.000, Vor allem das Sonvendviertel zerstört Kretas erwachsene Grätzl-Struktur - schrecklich!,kn
7880,554452,554450.0,6599,6231,2015-12-19 20:54:34.337,online,,Sie sind damit hip und haben ein crowdgefundetes Spielzeug gekauft. Quasi das craft beer unter den Leuchten!,9,0,0.0,0.0,0.0,0.0,0.0,0.0,1.0,0.0,0.0,0,Newsroom/Web/ITBusiness/Startupweb,Fluxo: Smarte Lampe aus Österreich ermöglicht volle Lichtkontrolle,2015-12-19 10:09:52.000, Sie kauften eine Hüfte und ein Crowd-Food-Spielzeug. Fast Craft Bier unter Lichtern!,kn
7881,554468,554460.0,6601,961,2015-12-19 23:18:31.893,deleted,,"Der nationalsozialismus hat ihn, mit dem ueberall sonst auf der welt die voelker schon seit jahrhunderten geknechtet und auagerottet wurden,  nach Europa gebracht. Das war das Neue. Ohne Kolonialrassismus kein Nationalsizialismus.",0,0,1.0,0.0,0.0,0.0,0.0,0.0,1.0,0.0,0.0,0,Newsroom/Wissenschaft/Natur,Die verlorene Ehre des Konrad Lorenz,2015-12-18 20:22:32.000," Der Nationalsozialismus hat ihn nach Europa gebracht, mit dem die Volckers seit Jahrhunderten versklavt und gehasst werden. Das war neu. Ohne kolonialen Rassismus gibt es keinen nationalen Cicidalismus.",kn
7888,558874,558870.0,6653,15735,2015-12-21 23:18:44.800,online,,"Ähm - Nein, auf sowas gehe ich nicht näher ein.

Habe noch nie jemanden getroffen, der stur und argumentationsresistent für Inzest UND Polygamie gekämpft hat. Viel Glück damit, gehen Sie in die Politik!
Übrigens, der Artikel war über eine (eben nicht eingeführte) gesetzliche Möglichkeit einer gleichgeschlechtlichen Ehe in Slowenien.",0,0,1.0,0.0,0.0,0.0,0.0,0.0,1.0,0.0,0.0,0,Newsroom/International/Europa/slowenien,Referendum: Slowenen stimmen gegen Homo-Ehe,2015-12-20 20:57:47.850," Ähn, ich werde nicht auf so etwas eingehen.    Niemals jemanden getroffen, der hartnäckig und argumentativ für Unmoral und Polygamie gekämpft hat. Viel Glück damit, gehen Sie in die Politik!  Übrigens ging es in dem Artikel um die rechtliche Möglichkeit der gleichgeschlechtlichen Ehe (nicht eingeführt) in Slowenien.",kn
7897,563267,563265.0,6734,5997,2015-12-24 19:49:05.347,online,,"Und wenn 20 Prozent frieren gehört die Demokratie und Rechtsstaatlichkeit abgeschafft, oder wie? Hören davon diese 20 Prozent dann zu frieren auf?",0,0,0.0,0.0,0.0,0.0,0.0,0.0,1.0,0.0,0.0,0,Newsroom/International/Europa/polen,"EU-Kommission betrachtet Polens Gesetzesänderungen als ""ungültig""",2015-12-23 18:18:53.160," Und wenn ein 20-prozentiger Stillstand zur Demokratie gehört und die Rechtsstaatlichkeit abgeschafft wird, oder wie? Werden diese 20 Prozent aufhören zu frieren?",kn
7913,570452,,6816,20237,2015-12-28 15:12:11.810,online,Gute Verbindungen zwischen Staaten herstellen,"Ironie oder Sarkasmus?
Staatshäuptlinge schaffen es allerbestenfalls ein von ihnen angezetteltes Köpfeeinschlagen irgendwann auch wieder zu beenden. Und sogar das meistens erst dann, nachdem einer der Häuptlinge abserviert ist.",0,0,0.0,0.0,0.0,0.0,0.0,0.0,1.0,0.0,0.0,0,Newsroom/International/EU,EU: Mit Volldampf an die Lösung alter Probleme,2015-12-28 05:30:00.000,"Schaffen gute Verbindungen zwischen Staaten Ironie oder Ironie?  Den Staatsoberhäuptern gelingt es gut, den Kopfbruch zu beenden, der irgendwann ausgelöst wurde. Und auch das ist in der Regel erst, nachdem man einen der Häuptlinge verlassen hat.",kn
7932,577540,,6897,14453,2016-01-01 12:46:09.030,online,"Unverschämt, wie man den Pröll durch den Kakao zieht",https://www.youtube.com/watch?v=Wb-LOzJnCog,0,0,0.0,0.0,0.0,1.0,0.0,0.0,1.0,0.0,0.0,0,Newsroom/Inland/bundespraesi,Die Entscheidung von Radlbrunn,2015-12-30 17:05:30.000,"Wie man Pröll durch Kakao https://www.youtube.com/watch?v=Wb-LOzJnCog zieht, ist empörend",kn
7935,577974,577973.0,6903,15770,2016-01-01 17:11:18.703,online,,Und wieviele Kopeken hast mit derlei sinnlosen Aktionen dann eingespart?,0,0,0.0,0.0,1.0,0.0,0.0,0.0,1.0,0.0,0.0,0,Newsroom/Web/ITBusiness,PC-Markt dürfte weiter schrumpfen – Kein Verkaufsschub durch Windows 10,2016-01-01 10:44:00.000, Und wie viele Copeks haben sich vor solchen sinnlosen Handlungen gerettet?,kn
7939,579024,,6918,5261,2016-01-02 11:28:50.683,deleted,,"""Allerdings nicht nur im Netz, auch in großen österreichischen Tageszeitungen wurden falsche Behauptungen über Flüchtlinge verbreitet.""

Irgendwie süß. Gerade der Standard, euphorisiert von der Willkommenshysterie, hat da gleichsam an vorderster Front mitgewirkt (da gabs auf einmal nur mehr Asylwerber aus Syrien, fast alle hatten mindestens einen Uni-Abschluss, der Arbeitsmarkt konnte nicht überleben ohne, der IS würde NIE jemanden über den Balkan einschleusen, etc etc). Gut, ist nur vom Format her eine der ""großen"" Tageszeitungen, aber dennoch, Lügen gibts und gabs von beiden Seiten. Bitte aber nicht im Glashaus sitzen und mit Steinen werfen.",0,0,1.0,0.0,1.0,0.0,0.0,1.0,1.0,0.0,0.0,0,Newsroom/Web/Netzpolitik/Hasspostings,Hetze gegen Flüchtlinge: Schärferes Gesetz gegen Hass-Poster in Kraft,2016-01-01 10:03:38.000," ""Allerdings wurden falsch aussagen über Flüchtlinge nicht nur in der Falle verbreitet, sondern auch in Österreichs großen Tageszeitungen.""    Irgendwie süß. Der Standard, der von einem besonders willkommenen Rausch bejubelt wird, ist an vorderster Front beteiligt (plötzlich gab es nur noch mehr Asylsuchende aus Syrien, fast alle hatten mindestens einen Universitätsabschluss, konnten nicht ohne Arbeitsmarkt leben, ISIS würde niemals jemanden auf den Balkan schmuggeln usw.). Nun, eine der ""großen"" Tageszeitungen ist nur in Bezug auf das Format, aber dennoch gibt es Lügen und wurden von beiden Seiten gegeben. Aber bitte nicht in einem Glashaus sitzen und Steine werfen.",kn
7955,584804,584788.0,6990,16887,2016-01-08 22:22:56.747,online,,"Industriell gehaltene Tiere verbrauchen 10x so viel Nahrung wie sie nach ihrem Tod abwerfen, bei ökologisch gehaltenen Tieren ist die Rate teilweise noch schlechter, da sie länger gehalten werden. In beiden Fällen werden letztlich aber leidensfähige Lebewesen umgebracht, selbst wenn man die Bio-Kuh zuvor nochmal umarmt hat. Fleischkonsum trägt einen großen Teil zur Regenwaldabholzung bei, verursacht Bodenerosionen, erzeugt Wasserknappheit in wasserarmen Regionen, begünstigt den Welthunger und hat noch viele weitere Folgen - für Tier UND Mensch.

Es ist also sehr wohl eine Frage des WAS.

Was jedoch nicht heißt, dass ich das Verhalten der erwähnten Veganern für gut befinde. Beruhigt aber bestimmt das Gewissen, auf andere zu zeigen.",2,0,1.0,0.0,0.0,0.0,0.0,0.0,1.0,0.0,0.0,0,Livingroom/Lifestyle/EssenTrinken,"Sarah Wiener: ""Habe mir noch nicht die Hörner abgestoßen""",2016-01-04 09:00:00.000," Industriell gehaltene Tiere fressen zehnmal mehr Nahrung, als sie nach ihrem Tod aussenden, und bei Bio-Tieren ist die Rate manchmal sogar noch schlechter, weil sie länger gehalten werden. In beiden Fällen werden die leidenden Kreaturen jedoch schließlich getötet, auch wenn die Bio-Kuh schon einmal wieder umarmt wurde. Der Fleischkonsum trägt zu einem großen Teil zur Abholzung des Regenwaldes bei, führt zu Bodenerosion, schafft Wasserknappheit in wasserarmen Gebieten, fördert den Hunger in der Welt und hat viele andere Folgen - für Tiere und Menschen.    Das ist also definitiv die Frage.    Aber das bedeutet nicht, dass ich das Verhalten der genannten Vegetarier für gut halte. Aber das Gewissen zu beruhigen, andere vorzuschlagen.",kn
7975,586807,586806.0,7029,21007,2016-01-05 23:06:41.210,online,"Hoffentlich schafft sich der Verein ab, bevor er Österreichs Volksgesundheit und Familienplanung abgeschafft hat.",,7,0,0.0,0.0,0.0,0.0,0.0,0.0,1.0,0.0,0.0,0,Newsroom/Inland/Parteien/oevp,"Arbeitszeit: Zwölf-Stunden-Tag hat für Mitterlehner ""Toppriorität""",2016-01-05 13:09:00.000,"Hoffen wir, dass sich der Verein selbst loswird, bevor er Österreichs Gesundheits- und Familienplanung abschafft. ",kn
7982,590007,590004.0,7055,21150,2016-01-07 09:48:16.730,online,Sie transportieren schon wieder Ihre (eigentlich für Rechtsrechte typische) Des-Inforation,,0,0,0.0,0.0,0.0,0.0,0.0,0.0,1.0,0.0,0.0,0,Newsroom/Panorama/Weltchronik/Uebergriffe_Koeln,Köln: Mehrere Verdächtige nach Überfällen identifiziert,2016-01-07 05:49:35.550,Sie tragen bereits Ihre (eigentlich nur rechtsrechtliche) De-in-Information ,kn
7984,591273,591269.0,7064,28722,2016-01-07 18:07:00.403,online,,"1. woher wissen sie, dass es nur ""westliche"" frauen waren die betroffen sind. 2. geht es dabei nicht darum frauen als schlampen zu sehen, sondern darum, dass frauen objekte sind über die man locker macht (spricht belästigung, gewalt) ausüben kann ohne große konsequenzen zu fürchten. was ein problem in unserem rechtsstaat darstellt, genauso, dass die überfälle auf flüchtlingsheime in deutschland so gut wie nie  aufgeklärt werden (das ist ja geradezu eine einladung weiterzumachen). und wir werden ja sehen, welche konsequenzen es für die täter geben wird. aber wir haben schon gesehen, was mit opfern von prominenten tätern medial gemacht wird. und da liegt einiges im argen im vielgepriesenen westen.",2,4,1.0,0.0,0.0,0.0,0.0,0.0,1.0,0.0,0.0,0,Newsroom/User/Userkommentare,Je suis féministe: Klare Ansage statt Aufschrei,2016-01-05 17:29:47.000," 1. Woher wissen sie, dass nur ""westliche"" Frauen betroffen waren? 2. Es geht nicht darum, Frauen als zu sehen, sondern um Frauenobjekte, die ausgeübt werden können, ohne große Konsequenzen zu befürchten (über Belästigung, Gewalt zu sprechen). Das ist ein Problem mit unserem Rechtsstaat, und die Angriffe auf Flüchtlingsheime in Deutschland werden fast nie deutlich gemacht (es ist fast eine Einladung zum Weitermachen). Und wir werden sehen, welche Konsequenzen es für die Täter haben wird. Aber wir haben bereits gesehen, was mit dem Opfer der Haupttäter in den Medien geschieht. Und im Westen gibt es etwas Schlimmes.",kn
7992,591401,,7069,8464,2016-01-07 22:38:17.810,online,,"Und wieder eine neue, bewusst versuchte Verharmlosung.

In diese Dimension in mittlerweile 12 (?) Städten in nur 1 Nacht hat es noch NIE nicht einmal im Ansatz gegeben. Nur damit das einmal klargestellt ist.",54,1,1.0,0.0,0.0,0.0,0.0,0.0,1.0,0.0,0.0,0,Newsroom/Panorama/Weltchronik/Uebergriffe_Koeln,Silvesterübergriffe in Köln: Bundespolizist befürchtete Tote,2016-01-07 14:05:41.000," Wieder ein neuer, bewusster Versuch, zu verharmlosen.    Jetzt 12 zu dieser Dimension (?) Städte hatten noch nie in nur 1 Nacht begonnen. Dies wird dadurch geklärt werden.",kn
8004,598114,,7122,26541,2016-01-09 10:05:31.893,online,tolle wahl mit tollen kandidaten wird das,da kommt mir nur in den sinn:  viele pfosten für einen posten,8,2,0.0,0.0,1.0,0.0,0.0,0.0,1.0,0.0,0.0,0,Newsroom/Inland/bundespraesi,Andreas Khol soll für ÖVP bei Präsidentenwahl kandidieren,2016-01-08 16:03:09.000,Beste Wahl mit tollen Kandidaten Dies ist nur in meinem Kopf: Viele Beiträge für den Posten,kn
8007,599212,599211.0,7132,3428,2016-01-09 14:42:40.583,online,,"Sie kennen den konkreten Volkswillen nicht. Bin auch für Neuwahlen, aber lassen Sie diese arroganten Aussagen..",3,25,0.0,0.0,1.0,0.0,0.0,0.0,1.0,0.0,0.0,0,Newsroom/Panorama/Weltchronik,Deutschland erwartet 2016 eine Million Flüchtlinge,2016-01-09 13:16:30.000," Sie kennen den festen Willen des Volkes nicht. Ich bin auch für Neuwahlen, aber ganz zu schweigen von diesen arroganten Äußerungen.",kn
8013,602078,,7155,19257,2016-01-11 11:15:03.337,online,,"Als jemand, der nicht braun rumgrölt, steht man offensichtlich fix auf der Moderationsliste und kann nur mit Stunden  Verzögerung mit Freischaltung rechnen. Ein schönes Publikum hast dir da heran gezüchtet, Standard.",9,2,0.0,0.0,1.0,1.0,0.0,1.0,1.0,0.0,0.0,0,Newsroom/Panorama/Weltchronik/Uebergriffe_Koeln,Justizminister: Angriffe in Köln waren über soziale Netzwerke organisiert,2016-01-10 08:38:06.610," Als jemand, der nicht braun brüllt, sind Sie eindeutig fest auf der moderaten Liste und können nur stundenlange Verzögerungen mit der Aktivierung erwarten. Schönes Publikum haben Sie dort angehoben, Standard.",kn
8015,602558,602556.0,7161,21058,2016-01-10 17:08:55.320,online,,"a ) Wer redet von ""Heilsbringern""? 
b) Sie vergleichen die US Präsidentschaft allen Ernstes mit dem Amt des österreichischen Bundespräsidenten?

Kritik ist ja durchaus erlaubt und in einer funktionierenden Demokratie auch wünschenswert, manche Handlungen VdBs kann man durchaus auch hinterfragen. Die Formulierung und das Timing  bringt aber sogar ein trotziger Schülerverein schwer zusammen. VdB Neoliberal? Profssiorales Image? Wer besser für die JG dann? Griss? Khol? Hundsdorfer? Und wenn sie, wie am Ende des Artikels angedeutet, lieber keinen hätten, dann ist's auch kurios, dass sie das erst ein paar Monate vor den Wahlen kundgeben.
Wieder einmal ein Beweis des Selbstzerfleischungs- und Ewigjammerinstinkts der Grünen .",1,0,1.0,0.0,1.0,0.0,0.0,0.0,1.0,0.0,0.0,0,Newsroom/Inland/bundespraesi,Grüne Jugend kritisiert Van der Bellens Kandidatur,2016-01-09 12:52:08.000," a) Wer spricht von ""Beschützern""?   b) Vergleichen Sie die US-Präsidentschaft ernsthaft mit dem Büro des österreichischen Präsidenten?    Kritik ist durchaus zulässig und wünschenswert auch in einer funktionierenden Demokratie, einige Aktionen des VDB können auch in Frage gestellt werden. Aber Worte und Zeit bringen einen trotzigen Studentenclub zusammen. VDB neoliberal? Prosiorales Bild? Wer ist also das Beste für JG? Gris? Khol? Handsdorfer? Und es ist interessant festzustellen, dass sie dies erst einige Monate vor der Wahl wissen werden, wenn sie es nicht haben, wie am Ende des Artikels angegeben.  Es ist wieder einmal ein Beweis für die Selbstzerstörung und die anhaltenden Murren der Grünen.",kn
8016,602561,602560.0,7162,2217,2016-01-10 15:39:36.680,online,,"Nur blöd das sich das zweite widerspricht, effektive Grenzsicherung kostet Geld und woher außer von den Sozialleistungen soll das kommen?",0,20,1.0,0.0,0.0,0.0,0.0,0.0,1.0,0.0,0.0,0,Newsroom/Panorama/Gesellschaft/integrationpano,Haslauer will niedrigere Mindestsicherung für Flüchtlinge,2016-01-10 13:22:46.000," Letzteres ist widersprüchlich, eine effektive Grenzsicherung kostet Geld, und ist es, abgesehen von sozialleistungsfern, nur dumm, woher das kommen soll?",kn
8026,605952,605946.0,7213,26250,2016-01-12 11:54:58.517,online,,Schwachsinn!,0,0,0.0,0.0,1.0,0.0,0.0,0.0,1.0,0.0,0.0,0,Newsroom/Panorama/Flucht/Flucht_und_Politik,Österreich: 90.000 Asylanträge im Jahr 2015,2016-01-12 07:15:27.000, Unklug!,kn
8035,607346,607345.0,7235,28656,2016-01-12 22:38:52.007,online,,"Mei sie Armer, war knapp vor dem Abkratzen ...",0,23,0.0,0.0,1.0,0.0,0.0,0.0,1.0,0.0,0.0,0,Newsroom/Web/Netzpolitik,Zuckerbergs Babyposting entzündet Impfgegner-Debatte,2016-01-12 10:52:53.000," Ich ist arm, bevor sie kratzt...",kn
8069,615368,615367.0,7346,3701,2016-01-15 17:24:27.210,online,,"Psychologen und Lehrer als Eltern... 
Bewahrheitet sich immer wieder",12,1,0.0,0.0,0.0,0.0,0.0,0.0,1.0,0.0,0.0,0,Livingroom/Familie/Kind/Elternblog,"Geschwisterrivalität: Was Eltern tun sollen, wenn Kinder streiten",2016-01-15 10:50:04.000, Psychologen und Lehrer als Eltern...   Immer wieder wahr,kn
8079,616098,616094.0,7363,30704,2016-01-16 16:37:08.693,online,,"Nein, natürlich gibt es nicht eine einzig richtige Lebensweise.

ABER wenn man in einem fremden Land aufgenommen wird, muss man nicht meinen dessen Bevölkerung von der eigenen Lebensweise und den eigenen Werten überzeugen zu müssen. 
Genau das passiert doch gerade.

Auf Afrika geh ich nicht näher ein. Da müsste man zu weit ausholen. Ich hoffe nur die Millionen, welche an der Küste warten bleiben uns erspart, so hart es klingt.

Und klar beruht unser Wohlstand auf der Armut der anderen, das hat jedoch jeder selbst in der Hand. Solange man in einen Kik oder Primarkt rennt wird sich das auch nicht ändern.
Ein wenig Eigenverantwortung und Bewusstsein sollte dann schon sein.",0,0,1.0,1.0,0.0,1.0,0.0,0.0,1.0,0.0,0.0,0,Newsroom/International/Afrika/BurkinaFaso,Burkina Faso: Mindestens 23 Tote bei Angriff auf Hotel,2016-01-15 21:53:28.300," Nein, natürlich gibt es keine richtige Lebensweise.    Aber wenn man im Ausland akzeptiert wird, muss man seine Bevölkerung nicht von seiner eigenen Lebensweise und Werten überzeugen.   Das ist es, was passiert.    Ich gehe nicht mehr nach Afrika. Sie müssen zu weit gehen. Ich hoffe, dass die Millionen von Menschen, die an der Küste warten, uns so hart retten werden, wie es klingt.    Und natürlich basiert unser Wohlstand auf der Armut anderer, aber jeder hat ihn in der Hand. Solange du zum Kicken oder Premarkt laufst, wird sich das nicht ändern.  Es muss bereits eine gewisse Eigenverantwortung und ein gewisses Bewusstsein geben.",kn
