,id_post,id_parent_post,id_article,id_user,created_at,status,headline,body,positive_votes,negative_votes,label_argumentsused,label_discriminating,label_inappropriate,label_offtopic,label_personalstories,label_possiblyfeedback,label_sentimentnegative,label_sentimentneutral,label_sentimentpositive,is_staff,article_path,article_title,article_publishing_date,text,lang
3247,6015,6014.0,94,28638,2015-06-02 14:21:36.867,online,,"Weil es dein meisten Leuten verständlicherweise vollkommen egal ist, was die Gesellschaft oder jede andere dahergelaufene Diskursgruppe von ihnen hält.",2,0,0.0,0.0,1.0,0.0,0.0,0.0,1.0,0.0,0.0,0,Newsroom/Web/Games/Berufsspieler,"Sexistischer Shitstorm gegen ""Fifa 16"": Ein Eigentor für die Spieler",2015-06-02 11:11:03.000," Denn den meisten Menschen ist es egal, was die Gesellschaft oder irgendeine andere Kanzelgruppe von ihnen hält.",kn
3285,9724,9721.0,140,9920,2015-06-03 12:20:29.250,online,,"Gabalier?
Künstler?
Bruahahaha!",5,1,0.0,0.0,1.0,1.0,0.0,0.0,1.0,0.0,0.0,0,Meinung/Kommentare/Sulzbacher,Festplattenabgabe: Gabalier bekommt nun Geld für Urlaubsfotos,2015-06-03 09:47:45.000, Gabalier?  Künstler?  Bruhahaha!,kn
3384,13076,,164,12465,2015-06-04 07:44:08.280,online,Es sind immer dieselben bigotten verlogenen Berufsheilige,"die mit ihren eigenen sexuellen - mitunter kranken und unmoralischen - Phantasien nicht zurecht kommen und genau aus diesem Grund alles was anders ist verteufeln. 

Peinlich und nicht zeitgemäß",4,5,1.0,0.0,1.0,0.0,0.0,0.0,1.0,0.0,0.0,0,Newsroom/International/Europa/deutschland,Homophobie: Empörung über Regierungschefin des Saarlandes,2015-06-03 18:27:52.000,"Sie sind immer die gleichen fanatischen Berufsheiligen, die mit ihren eigenen sexuellen - manchmal kranken und unmoralischen - Fantasien nicht umgehen können und genau aus diesem Grund alles anders verteufeln.     Seltsam und alt",kn
3465,18390,,285,29361,2015-06-07 22:28:16.003,online,so ein psycho,,0,0,0.0,0.0,1.0,0.0,0.0,0.0,1.0,0.0,0.0,0,Newsroom/Panorama/wien,"Schuldspruch gegen Wiener Anwalt, der Neunjähriger den Arm brach",2015-06-02 13:38:43.000,So ein Psycho ,kn
3472,18881,18879.0,296,144,2015-06-08 11:04:57.817,online,,leider hat keine Band so schwer abgebaut wie Manowar seit der Triumph. Mittlerweile könntens schon zusammen mitn Gabalier auftreten :(,2,0,0.0,0.0,0.0,1.0,0.0,0.0,1.0,0.0,0.0,0,Newsroom/Kultur/Musikkultur/Musikfestival,Metallica: Streichkäse am Jeansgilet,2015-06-05 10:59:59.000, Leider ist seit dem Sieg keine Band so stark zerbrochen wie Manover. Gabalier :( in der Zwischenzeit,kn
3481,19412,19404.0,313,15214,2015-06-08 17:40:24.630,deleted,in Gladbeck (D) ruft der per Lautsprecher 3 mal am Tag !!,,0,0,0.0,0.0,0.0,1.0,0.0,0.0,1.0,0.0,0.0,0,Newsroom/Panorama/Chronik/gerichtsreportagen,Terrorprozess: Der seitenspringende Chauffeur,2015-06-08 12:59:16.390,Lautsprecheranrufe 3 mal am Tag in Gladbeck (D) !! ,kn
3516,23038,23037.0,368,26167,2015-06-09 23:50:39.673,online,,"Ja, der sollte sich mal den Film Der Untergang reinziehen. :)",3,0,0.0,0.0,0.0,1.0,0.0,0.0,1.0,0.0,0.0,0,Newsroom/International/Europa/ukraine,Neue Kämpfe in der Ukraine: Feuer an allen Fronten,2015-06-09 17:49:33.980," Ja, sie sollten den Film The Fall machen. :)",kn
3547,25320,,402,1441,2015-06-10 14:57:09.987,online,,"Und weiter geht's mit dem Kasperltheater ...........

http://diepresse.com/home/politik/innenpolitik/kulisse/4751313/Vier-neue-Kopfe-fur-OVP-Wenn-sie-wollen-durfen-sie",0,0,0.0,0.0,0.0,0.0,0.0,0.0,1.0,0.0,0.0,0,Newsroom/Inland/Parlament/Nationalrat,Ex-Stronach-Mandatare: Kreuzweise Mitarbeiter-Anstellung war legal,2015-06-09 13:08:22.070, Und wir gehen mit dem Kasperl-Theater.....    http://diepresse.com/home/politik/innenpolitik/kulisse/4751313/Vier-neue-Kopfe-fur-OVP-Wenn-sie-wollen-durfen-sie,kn
3626,27821,27820.0,447,3112,2015-06-11 18:08:32.163,deleted,,"erstens ist die Zahl erfunden, und selbst wenn..., wenn deren kultureller Hintergrund der ""anatolische Islam"" gewesen wäre, dann wärs nix mit Gleichberechtigung zw. Mann und Frau, nix mit Life Ball, Conchita Wurst usw. ums mal so zu formulieren",5,1,0.0,1.0,0.0,0.0,0.0,0.0,1.0,0.0,0.0,0,Newsroom/Panorama/Gesellschaft/demografischerwandel,Österreichs Bevölkerung wuchs im Vorjahr um 77.000 Menschen,2015-06-11 13:01:46.000," Zuerst wird diese Zahl entdeckt, und... Obwohl ihr kultureller Hintergrund ""Anatolyan Islam"" ist, dann wird es nichts mit Gleichheit zwischen Mann und Frau geben, nichts mit Lifeball, Conchita verst, etc.",kn
3641,28278,,469,29633,2015-06-12 02:21:40.147,online,Wie oft noch?,"Wann kapiert der letzte der roten Gfrieser, das mit der ÖVP kein Land zu machen ist?
Jede Wahl verlieren, aber danach immer mehr und bessere Posten. Die SPÖ medial prügeln als Wirtschaftsdeppen, aber in einer Nacht alleine bei den Bayern mal schnell 18 Miliarden versenken. Danach krank sein, und bei der schwarzen Mafia RAIFFEISEN als  Farina und Finis Feinste Vorstandssprecher (LLI).
Was opfert diese SPÖ noch alles für einige Tage an der Macht?
Also wenn nicht mal bald eine andere Politik kommt, ist der letzte Wähler noch bereit die ""Barbabas"" zu wählen als die ehemals zwei Großparteien.",8,1,0.0,0.0,1.0,0.0,0.0,0.0,1.0,0.0,0.0,0,Newsroom/Inland/bundeslaender/Steiermark,Schwarz-Rot in der Steiermark: Schützenhöfer weist Erpressungsvorwürfe zurück,2015-06-11 09:00:11.820,"Wie oft noch? Wann wird der letzte der roten Gfryser, der nicht ÖVP sein kann, ein Land?  Wenn jede Wahl verloren, aber mehr und mehr gute Posten danach. Die SPÖ in den Medien schlägt als Wirtschaftsente zu, aber bei den Bayern sinken sie schnell 18 Milliarden in einer Nacht. Danach, sei krank, und als bester CEO (LLI) der schwarzen Mafia Rifesen Farina und Fini.  Was opfert diese SPÖ noch für ein paar Tage im Amt?  Wenn es also bald keine andere Politik mehr gibt, ist der letzte Wähler immer noch bereit, für ""Barbabas"" zu stimmen und nicht für die beiden vorherigen großen Parteien.",kn
3656,28480,28478.0,479,10954,2015-06-12 19:59:46.200,online,,"Genau, ich kauf mir ein iPad, schließe ne Maus, Tastatur, externen Bildschirm und Lautsprecher an und schon brauche ich kein Notebook mehr...eine tolle Erfindung...",0,0,1.0,0.0,0.0,0.0,0.0,0.0,1.0,0.0,0.0,0,Newsroom/Web/Innovationen/Apple,Apple hat endlich eine Aufgabe für das iPad: Den Laptop ersetzen,2015-06-12 09:37:11.000," Genau, ich kaufe ein iPad, kontaktiere eine Maus, Tastatur, externen Bildschirm und Lautsprecher und ich brauche kein Notebook mehr... Eine große Entdeckung...",kn
3687,35504,,546,22145,2015-06-14 14:54:58.457,deleted,"So, jetzt schreibe ich es zum zweiten Mal:","Am Bild, welches sie von der Band verwenden, sind die Angaben falsch. 

Sie müssen den Urheber angeben. 

Oder muss man sie per Unterlassungserklärung kontaktieren damit das funktioniert?

Eines können sie: Das Posting, in dem ich sie bereits darauf aufmerksam gemacht habe, einfach unterdrücken. Perfekt!

Bitte gehts noch? Wenn sie nicht verstehen (wollen) wie das Spiel läuft, dann schicken sie gefälligst eine eigenen Fotografen hin. Sie werden sich wundern, was das dann kostet.",0,0,1.0,0.0,0.0,0.0,0.0,1.0,1.0,0.0,0.0,0,Newsroom/Web/Netzpolitik/napster,"""Kaiser Franz Josef"": Festplattenabgabe kommt nie beim Musiker an",2015-06-14 09:17:28.000,"Also, jetzt schreibe ich es zum zweiten Mal: auf dem Bild, das sie von der Band verwenden, sind die Informationen falsch.     Sie müssen den Autor angeben.     Oder sollten Sie sie per einstweiliger Verfügung kontaktieren, damit dies funktioniert?    Eine Sache, die sie tun können: Curb die Posting habe ich bereits bewusst gemacht. perfekt!    Bitte arbeiten Sie noch? Wenn sie nicht verstehen, wie das Spiel läuft, schicken sie ihre eigenen Fotografen. Sie fragen sich, wie viel es kosten wird.",kn
3705,43952,43948.0,634,14853,2015-06-16 22:17:28.560,online,,"Pssst!!! Hör auf ihn zu provozieren, jetzt sagt er sicher gleich ""Steffen Hofmann"". :-D",0,0,0.0,0.0,0.0,1.0,0.0,0.0,1.0,0.0,0.0,0,Newsroom/Sport/Fussball/Bundesliga/TipicoLiga/RedBull,"Hütter: ""Ich sehe mich nicht als Ausbildungstrainer""",2015-06-16 14:06:35.000," Psst!!! Hört auf, ihn zu provozieren, jetzt sagt er ""Steffen Hoffman"", natürlich."" :-D",kn
3727,52021,,752,26675,2015-06-19 20:30:31.973,online,,das ist die de facto Preisabsprache Rewe-Spar bei der Hofer freudig mitmacht,6,0,0.0,0.0,0.0,0.0,0.0,0.0,1.0,0.0,0.0,0,Newsroom/Wirtschaft/Lebensmittelwirtschaft,Heimische Lebensmittelpreise EU-weit auf Platz zwei,2015-06-19 12:44:13.000," Dies ist ein realistischer Preis-Deal-Spar, an dem Hofer gerne teilnimmt",kn
3746,52118,,758,16323,2015-06-20 12:27:01.843,online,Funktionierende Demokratie?,"In einer solchen wuerden Parlament und freie Medien den Machhabern auf die Finger schauen, bevor diese voellig unertraeglich werden. Die Medien scheinen jedoch zu versagen, denn wie ist es sonst erklaerlich, dass wir ueber solche Umtriebe im Dunkeln bleiben? Und nicht nur was die Banken beyrofft, sondern auch sonst. Die Medien als Handlanger derjenigen, die das Volk fuer bloed verkaufen.",2,3,0.0,0.0,0.0,0.0,0.0,0.0,1.0,0.0,0.0,0,Newsroom/Wirtschaft/Finanzen/Banken/Volksbanken,ÖVAG kurz vor dem Ende,2015-06-20 09:00:00.000,"Eine funktionierende Demokratie? In solchen Parlamenten und offenen Medien betrachteten Maschinen sie, bevor sie völlig unerschöpflich wurden. Es scheint jedoch, dass die Medien versagen, denn wie können wir erklären, dass wir über solche Aktivitäten im Dunkeln bleiben? Und nicht nur das, was die Banken tun, sondern auch umgekehrt. Die Medien als Handlanger derer, die Menschen verkaufen, um aufzublähen.",kn
3790,54968,54966.0,807,7800,2015-06-22 08:42:28.987,online,,"Nicht jede Vereifachung, erfasst den dahinter liegende Sinn. Sie sollten diese Stilart noch ein wenig ueben (aber bitte nicht hier)",2,2,0.0,0.0,1.0,1.0,0.0,0.0,1.0,0.0,0.0,0,daStandard/daBildung,Junge Migranten: Alles Machos?,2015-06-22 05:30:00.000, Nicht jeder Sin-Blower fängt die Bedeutung dahinter ein. Sie sollten ein wenig von diesem Stil hinzufügen (aber bitte nicht hier),kn
3910,64748,64747.0,939,3603,2015-06-24 21:46:28.593,online,,"ich korrigiere mich: wohl gut gemeinte, an Dümmlichkeit grenzende Naivität ist die bessere Bezeichnung. Wenn Grenzkontrollen nicht hülfen, würde halb Mexiko in den USA wohnen",5,0,0.0,0.0,0.0,0.0,0.0,0.0,1.0,0.0,0.0,0,Newsroom/Panorama/Flucht/Fluechtlinge_in_Oesterreich,Flüchtlingsstreit: Mikl-Leitner droht Ungarn mit Grenzkontrollen,2015-06-24 17:26:54.000," Ich rechtt mich: Gut gemeinte Unschuld, die an Dummheit grenzt, ist ein guter Name. Wenn Grenzkontrollen nicht funktionieren, lebt die Hälfte Mexikos in den USA.",kn
3912,64762,64761.0,942,2268,2015-06-25 13:30:30.240,online,Facepalm,und deshalb sind sie keine Mütter von Soldaten mehr die mit fadenscheinigen gründen in die ukraine geschickt werden für einen sinnlosen krieg und dort krepieren.,0,1,0.0,0.0,0.0,0.0,0.0,0.0,1.0,0.0,0.0,0,Newsroom/International/Europa/ukraine,"US-General: ""Putin will keinen Kampf mit Nato""",2015-06-24 12:00:01.000,"Gesicht Palm und so sind sie nicht mehr Mütter von Soldaten, die in die Ukraine geschickt werden, die mit trivialen Gründen für bedeutungslosen Krieg geschickt werden und schleichen dort.",kn
4096,70664,70662.0,1069,14925,2015-06-29 14:48:48.180,online,"""was hab ich davon das ....""","Wer ist ""ich""?

Wenn ""ich"" ich bin und ich bin betroffen - weil zum Beispiel meine Tochter/Frau/sonstjemanddermirliebist bis zum Tode mißbraucht wurde - habe ich wahrscheinlich gar nichts von einer gesellschaftlich in höchster humanistischer Güte stattfindende Betreuung und Resozialisierung des Täters.

Wenn ""ich"" diese humanistische Gesellschaft bin und zum Beispiel Ihre Tochter/Frau/sonstjemandderIhnenliebist bis zum Tode mißbraucht wurde - stell ich mich gerne her und schwafel was von Werten der humanistischen und aufgeklärten Gesellschaft.


Ja, die Welt wär eine bessere, wenn sie eine bessere wäre - ist sie aber nicht.",1,1,1.0,0.0,0.0,0.0,0.0,0.0,1.0,0.0,0.0,0,Meinung/Kolumnen/rabinowi,Zu Tode gestraft,2015-06-28 18:44:16.000,"""Was bekomme ich dafür..."""" . Wer ist ""Ich""?    Wenn ""ich"" selbst und ich betroffen wären - weil zum Beispiel meine Tochter/Frau/andere Geliebte zu Tode missbraucht wurde - habe ich wahrscheinlich nicht die soziale Fürsorge und Rehabilitierung eines Verbrechers in höchster humanistischer Güte.    Wenn ""Ich"" diese humanistische Gesellschaft ist und zum Beispiel Deine Tochter/Frau/andere Person zu Tode missbraucht wurde - ich mache mich gerne zu recht und schwöre auf die Werte einer humanistischen und reifen Gesellschaft.      Ja, die Welt wäre besser, wenn sie besser wäre - aber das war es nicht.",kn
4118,71694,71693.0,1089,11228,2015-06-30 12:12:24.437,online,,ja die meisten f-fanboys sind sich auch nicht ganz bewusst wovon sie da fan sind...,0,0,0.0,0.0,1.0,1.0,0.0,0.0,1.0,0.0,0.0,0,Newsroom/Panorama/Gesellschaft/bettelverbot_neu,Erster Einspruch gegen Bettelstrafen in Salzburg,2015-06-29 12:52:37.000," Ja, die meisten F-Fanboys sind Noms, nicht ganz wissen, welcher Fan sie sind...",kn
4120,72051,72050.0,1093,25977,2015-06-29 14:44:19.763,online,Sie regen sich auch...,"...sicher ueber die Hetze der FPOe auf. Wenn ja, wuerde ich mich einmal vor den Spiegel stellen.",2,0,0.0,0.0,1.0,0.0,0.0,0.0,1.0,0.0,0.0,0,Meinung/fsmisik,Wie atemberaubender Dilettantismus Europa an den Abgrund führt,2015-06-28 17:00:00.000,"Sie sind auch aufgeregt... ... Über die Provokation der FPÖ. Wenn ja, hätte ich vor dem Spiegel gestanden.",kn
4463,77217,77211.0,1178,28291,2015-09-07 20:45:29.993,online,"vor aölem nach den müllbergen am wochenende, die die gemeinde von den türken dann auf gemeindekosten entsorgen darf..",,2,0,0.0,1.0,0.0,0.0,0.0,0.0,1.0,0.0,0.0,0,daStandard/daAlltag,"""Verschmutzte Parks, laute Kinder, Ausländer""",2015-06-30 21:11:04.000,"Vor aölem nach Bergen von Müll über das Wochenende, kann die Gemeinde dann auf kommunale Kosten von den Türken entsorgen. ",kn
4464,77237,77235.0,1182,2227,2015-07-01 13:56:48.497,online,,"Mit anderen Worten: nachträgliche Sanierung unhaltbarer Wahlversprechen.

Dass bei uns noch keiner auf solche Ideen gekommen ist...",8,3,0.0,0.0,0.0,0.0,0.0,0.0,1.0,0.0,0.0,0,Newsroom/Wirtschaft/Wirtschaftpolitik/Finanzmaerkte/Griechenlandkrise,Griechenland: Krach in regierender Syriza-Partei,2015-07-01 07:56:17.000," Mit anderen Worten, die Lösung nach ungerechtfertigten Wahlversprechen.    So etwas hat sich noch niemand einfallen lassen...",kn
4502,93380,93379.0,1340,15050,2015-07-06 02:25:11.493,online,,"Jo, im Parlament wird immer nur gewürfelt, ist Ihnen das noch immer nicht bekannt?",1,0,0.0,0.0,0.0,0.0,0.0,0.0,1.0,0.0,0.0,0,Newsroom/Wirtschaft/Finanzen/EUSchuldenkrise,Das große Nein gegen Berlin und die Gläubiger,2015-07-05 22:18:38.860," Joe, es gibt immer einen Würfel im Parlament, weißt du noch nichts davon?",kn
4515,101264,101259.0,1443,22195,2015-07-08 18:11:35.803,deleted,Bosniaken,"Waren  doch ""nur"" Opfer. Die 35.000  Toten  serbischen Zivilisten  haben sich alle selber  umgebracht. Naser  Oric  war ja auch  nur ein Verteidiger und kein Schlächter.",0,0,1.0,0.0,0.0,0.0,0.0,0.0,1.0,0.0,0.0,0,Newsroom/International/Europa/Bosnien,Srebrenica-Resolution: Russland legt Veto ein,2015-07-08 08:50:47.080,"Die Bosniaken waren ""nur"" Opfer. Die 35.000 serbischen Zivilisten, die ums Leben kamen, haben sich alle selbst getötet. Nasser Orrick war nur ein Verteidiger, kein Metzger.",kn
4527,108963,108961.0,1556,16246,2015-07-12 09:12:21.130,online,,"als erstes und wichtigstes werden O-cards (abkürzung für Ordinationskarte) verwendet, um die Ordination am System anzumelden. Ohne Anmeldung kein E-Card system .... aber bitte ... lassen Sie die O-Cards einziehen und zahlen Sie in Zukunft jeden Arztbesuch selber - dann mit der Rechnung zur GKK und warten bis Sie das Geld rücküberwiesen bekommen (oder auch nicht) ....",6,0,1.0,0.0,0.0,0.0,0.0,0.0,1.0,0.0,0.0,0,Newsroom/Inland/Sachpolitik/sv,Vorerst kein Foto auf E-Card,2015-07-10 09:47:14.000," Erste und wichtigste O-Karten (Abkürzung der Ordinationskarte) werden verwendet, um die Koordination auf dem System zu registrieren. Kein E-Card-System ohne Registrierung .... Aber bitte ... Bewegen Sie O-Karten und zahlen Sie für jeden Arztbesuch in der Zukunft - dann mit der Rechnung zu ccc und warten, bis Sie das Geld zurück (oder nein) ....",kn
4532,111279,111278.0,1582,23353,2015-07-13 21:14:31.223,deleted,,"nur rumänien??? wie wales in topf eins kommt wundert sie nicht???

und das blöde gelaber von wegen leistung. die fifa rangliste hat massivste schwächen. kein mensch, der klar denken kann, wird das nicht einsehen.

1. kann zb sogar ein sieg die quote nach unten drücken (weil der schnitt errechnet wird)
2. ist es von nachteil sich für ein großturnier zu qualifizieren und dort drei vorrundenspiele zu verlieren im vergleich zu einer verlorenen barrage
3. ein gastgeber fällt in der rangliste zurück, weil er keine ernstkämpfe mehr bestreitet
4. freundschaftsspiele gehören raus aus der wertung",1,0,1.0,0.0,0.0,0.0,0.0,0.0,1.0,0.0,0.0,0,Newsroom/Sport/Fussball/WM2018,Österreich in WM-Quali in Topf zwei,2015-07-09 15:06:00.000," Rumänien ist das einzigeland??? Sie wundert sich nicht, wie Wales in den Topf kommt???    Und dumme Gelabar wegen der Leistung. Das Ranking der Fifa hat sich enorm abgeschwächt. Niemand, der denken kann, sieht es klar.    1. Zum Beispiel können Hindernisse auch nach unten gedrückt werden, um zu gewinnen (weil der Durchschnitt berechnet wird) 2. Die Qualifikation für ein großes Turnier ist unbequem und drei Vorrundenspiele im Vergleich zur verlorenen Sperre 3 zu verlieren, ist ein Nachteil. Die Gastgeber werden in der Rangliste zurückfallen, da sie nicht mehr in ernsthaften Kämpfen 4 antreten werden. Freundschaftsspiele sind aus der Tabelle",kn
4540,117952,117949.0,1632,18984,2015-07-14 18:13:47.700,online,,"Tja, wenn die Kleine Zeitung das sagt!! Wäre auch ihr letzter Blödsinn gewesen, hätte sie am Ende gemeint, dass Frau Heinisch-Hosek die beste Ministerin ist.",0,0,0.0,0.0,1.0,1.0,0.0,0.0,1.0,0.0,0.0,0,Newsroom/Inland/Parteien/fp,Zeitung: Kickl wird illegale Parteifinanzierung vorgeworfen,2015-07-14 11:44:44.920," Nun, wenn die Kleinzeitung das sagt!! Wenn ihre letzte Torheit wäre, hätte sie gesagt, Frau Hainish-Hosek sei die beste Ministerin.",kn
4541,117953,,1633,12491,2015-07-14 14:33:19.270,online,,"Hass ist nicht das richtige Wort, denn hassen kann man eigentlich nur jemand, den man geistig auf der gleichen oder einer übergeordneten Ebene verortet. In letzterem
Fall würde man wohl eher von Ressentiment sprechen.",4,5,1.0,0.0,1.0,0.0,0.0,0.0,1.0,0.0,0.0,0,Newsroom/Inland/bundeslaender/ipowien,"Strache sieht in ""FPÖ-Hass"" Beleg für eigene Relevanz",2015-07-14 12:53:08.000," Hass ist nicht das richtige Wort, denn man kann nur jemanden hassen, der sie geistig auf die gleiche oder hohe Ebene stellt. Beim zweiten Mal spricht man von Ressentiments.",kn
4548,122905,122904.0,1691,16909,2015-07-16 20:05:08.570,online,Muss man Ihnen alles erklären?,"Sie glauben es wär DREI Polizisten unmöglich, jemanden zu beschatten ohne selbst entdeckt zu werden (abgesehen davon, dass man einen Polizisten weiter entfernt rausschickt um die Jungs in Sicherheit zu wiegen)?
Und für was glauben Sie eigentlich gibt es verdeckte Fahnder?",0,0,1.0,0.0,1.0,0.0,0.0,0.0,1.0,0.0,0.0,0,Newsroom/Panorama/Chronik/gerichtsreportagen,Körperverletzungsprozess: Majoran und Polizeiprügelvorwurf,2015-07-16 14:30:57.000,"Müssen Sie alles erklären? Glauben Sie, dass es für drei Polizisten unmöglich ist, zu schatmen, ohne jemanden zu identifizieren (außer einen Polizisten weiter weg zu schicken, um die Jungen sicher zu wiegen)?  Und wofür sind Ihrer Meinung nach geheime Ermittler da?",kn
5074,148461,148454.0,1924,1010,2015-07-24 22:11:36.870,online,Die Freiheit nehme ich mir,"Für Leute, die mit Flammenwerfern hantieren wollen, ist der Nasse Fetzen gerade recht!",15,0,0.0,0.0,0.0,0.0,0.0,0.0,1.0,0.0,0.0,0,Newsroom/Web/Netzpolitik/Hasspostings,Porsche entlässt Lehrling nach Hassposting auf Facebook,2015-07-24 11:09:44.000,"Ich nehme Freiheit Für Menschen, die Flammenwerfer verwalten wollen, sind nasse Scheiben richtig!",kn
5075,148473,,1924,27712,2015-07-25 00:32:56.873,online,"Hallo Thomas,","ich mache Dich darauf aufmerksam, daß Du hier in Gutmenschen-Forum unterwegs bist! Hier gibt's keine Gnade!",1,8,0.0,1.0,1.0,1.0,0.0,0.0,1.0,0.0,0.0,0,Newsroom/Web/Netzpolitik/Hasspostings,Porsche entlässt Lehrling nach Hassposting auf Facebook,2015-07-24 11:09:44.000,"Hallo Thomas, ich möchte Sie darauf aufmerksam machen, dass Sie im Gutmenschen-Forum sind! Keine Gnade hier!",kn
5093,162579,162577.0,2062,4977,2015-07-29 18:00:52.230,online,,Aha! Ich bin also ein Beispiel für fehlende Bildung... :(,1,0,0.0,0.0,0.0,1.0,0.0,0.0,1.0,0.0,0.0,0,Newsroom/Web/Netzpolitik/Hasspostings,Hasspostings: Rotes Kreuz entlässt zwei Mitarbeiter,2015-07-29 10:04:13.000, Ah! Ich bin also ein Beispiel für mangelnde Bildung... :(,kn
5318,173962,,2181,29289,2015-08-03 11:15:10.977,online,,"Die fahren ja sogar durchs ärgste Gedränge am Donauinselfest oder jetzt aktuell am Rathausplatz durch die Filmfestival-Standeln (obwohl da groß und deutlich an den Eingängen steht ""Fußgängerzone - Radfahren nicht erlaubt"")",3,1,1.0,0.0,0.0,1.0,0.0,0.0,1.0,0.0,0.0,0,Newsroom/Panorama/wien/Mariahilferstrasse,Bau der neuen Mariahilfer Straße abgeschlossen,2015-07-31 17:45:49.000," Sie fahren durch schlechte Menschenmengen beim Donauinselfest oder jetzt durch die Filmfeststände am Rathasplatz (obwohl groß und klar an den Eingängen ""Fußgängerzone - Radfahren ist nicht erlaubt"")",kn
5328,182280,182270.0,2251,19584,2015-08-05 10:06:59.200,online,wenn ich dafür die EU oder Facebook brauche,"dann gute Nacht 2043.

wenn diese socialmedia Kampagnen immer so gut funktionieren - dann gute Nacht, wenn das mal ein vifes Kerlchen einsetzt.",1,0,0.0,0.0,0.0,0.0,0.0,0.0,1.0,0.0,0.0,0,Newsroom/Web/Netzpolitik/Hasspostings,Wie sich ein Deutscher gegen Flüchtlingshetze im Netz starkmacht,2015-08-05 06:29:42.000,"Wenn ich die EU oder Facebook für diese gute Nacht 2043 brauche.    Wenn diese Social-Media-Kampagnen immer sehr gut funktionieren - dann gute Nacht, wenn es eine Wiffs-Person ist.",kn
5333,185981,,2285,13857,2015-08-06 16:24:51.823,online,,"gebrannt ist da höchstens der Korn, in dem das ganze angesetzt ist. Ein wenig Ahnung von dem über das man schreibt sollte man schon haben, oder?",1,1,0.0,0.0,1.0,0.0,0.0,1.0,1.0,0.0,0.0,0,Livingroom/Lifestyle/EssenTrinken/essobjekt,Samtiger Biozirbenschnaps,2015-08-06 07:57:01.000," Höchstens das Korn, das das Ganze bestimmt, wird verbrannt. Eine kleine Vorstellung davon, was du schreibst, musst du haben?",kn
5334,186974,,2299,335,2015-08-06 15:23:46.543,online,,"Wenn Niessl auf Biegen und Brechen ""gestalten"" will, dann sollte er z.B. einen Töpferkurs besuchen.",4,1,0.0,0.0,1.0,0.0,0.0,0.0,1.0,0.0,0.0,0,Newsroom/Inland/bundeslaender/burgenland,Niessl aus Freiheitskämpferbund ausgetreten,2015-08-06 12:10:34.000," Wenn Neasl beim Biegen und Brechen ""entwerfen"" will, dann ist er es. B muss an einem Töpferkurs teilnehmen.",kn
5345,188570,,2331,26680,2015-08-07 17:31:08.477,online,meine oma sagte häufig.,"ein depperl hat's gut,
denn einem depperl tut nichts weh.

warum denke ich an diesen spruch, wenn es um bumsti geht???",2,1,0.0,0.0,1.0,0.0,0.0,0.0,1.0,0.0,0.0,0,Meinung/Kolumnen/rau,Strache wittert Mord,2015-08-06 17:22:04.000,"Meine Großmutter hat es oft gesagt. Depperl hat es gut, denn Depperl tut nichts weh.    Warum denke ich das, wenn es um Bamsty geht???",kn
5351,190663,190662.0,2359,9048,2015-08-09 10:14:32.043,online,,"Achso, das ist für Dich also keine Doppelmoral, gell? 

Im Interview sagen, er würde sowas nie aufpicken, aber dann bei einem Sender arbeiten, wo die Werbung von Wettbüros ununterbrochen kommt... 

Nein, gar nicht.... passt schon so.",1,7,1.0,0.0,1.0,0.0,0.0,0.0,1.0,0.0,0.0,0,Newsroom/Etat/ORFReform/orfprogramm,"Hackmair: ""Hole mir Inspiration von Mehmet Scholl""",2015-08-08 17:00:00.000," Oh, das ist keine Doppelmoral für dich, Gel?     Im Interview sagt er, dass er sich nie so etwas auswählt, aber dann funktioniert die Anzeige ständig am Bahnhof, der von Wettbüros kommt...     Nein, nein.... Passt so.",kn
5352,191486,191470.0,2363,22035,2015-08-09 15:12:20.713,online,,Und das trauen Sie sich auch noch laut hier posten?,1,0,0.0,0.0,0.0,1.0,0.0,0.0,1.0,0.0,0.0,0,Newsroom/Web/Telekommunikation/Handy/Android,Samsung Galaxy Note 5 und S6 Edge+: Händler leakt alle Daten,2015-08-09 10:15:07.000, Und wagen Sie es hier laut zu posten?,kn
5363,198591,,2430,5315,2015-08-11 20:13:01.977,online,,"Wahrheitsresistenz, Beratungsresistenz, Freunderlwirtschaft.",3,2,0.0,0.0,0.0,0.0,0.0,0.0,1.0,0.0,0.0,0,Newsroom/Wirtschaft/Wirtschaftpolitik/Finanzmaerkte/Griechenlandkrise,Sparpaket für Griechenland wurde deutlich entschärft,2015-08-11 06:11:28.110," Wahrheitswiderstand, Konsultationswiderstand, freundliche Wirtschaft.",kn
5371,201088,,2460,9724,2015-08-12 16:54:21.287,online,,Nestle kämpft um (s)einen guten Ruf. Das ist der Sommerwitz schlechthin.,19,0,0.0,0.0,0.0,0.0,0.0,0.0,1.0,0.0,0.0,0,Newsroom/Wirtschaft/Unternehmen,Nestlé: Maggi-Krise weitet sich aus,2015-08-12 12:26:31.000, Nestle (S) kämpft um einen guten Ruf. Das ist der Sommerwitz par excellence.,kn
