,id_post,id_parent_post,id_article,id_user,created_at,status,headline,body,positive_votes,negative_votes,label_argumentsused,label_discriminating,label_inappropriate,label_offtopic,label_personalstories,label_possiblyfeedback,label_sentimentnegative,label_sentimentneutral,label_sentimentpositive,is_staff,article_path,article_title,article_publishing_date,text,lang
8721,900598,,10776,25987,2016-04-22 18:43:56.230,online,,"Wie viele Asylanträge hatte Lettland schnel? Rd.1.500 - aber seit 1998!!!

Danke setzen.",38,3,1.0,0.0,0.0,0.0,0.0,0.0,1.0,0.0,0.0,0,Newsroom/Panorama/Flucht/Flucht_und_Politik,Europarat warnt Österreich vor neuem Asylgesetz,2016-04-22 17:25:35.000, Wie viele Asylanträge hatte Lettland? RD 1.500 - aber seit 1998!!!    Danke.,kn
8722,900641,,10780,26456,2016-04-22 19:38:58.747,deleted,"""Da muss man voll mit der Integration reinfahren"", sagen Experten.",Nach rezentem Vorfall diesem eine höchst fragwürdige Formulierung!,0,0,0.0,0.0,0.0,0.0,0.0,1.0,1.0,0.0,0.0,0,Meinung/Kolumnen/rau/Einserkastlrau,Sexuelle Übergriffe: Explosive Mischung,2016-04-22 17:47:17.000,"""Man muss sich mit Integration auseinandersetzen"", sagt der Experte. Diese fragwürdigste Formulierung nach dem letzten Vorfall!",kn
8727,903300,903298.0,10809,27103,2016-04-24 12:42:15.593,online,,Schwere Nacht gehabt?,0,0,0.0,0.0,0.0,1.0,0.0,0.0,1.0,0.0,0.0,0,Newsroom/Inland/bundespraesi,Präsidentschaftswahl: Die Außenseiter in der Favoritenrolle,2016-04-23 15:00:00.000, Hatte eine harte Nacht?,kn
8728,905121,,10825,3422,2016-04-24 19:38:12.223,online,Eh logisch.,"Das Ergebnis ist exakt was ich in meinem Umfeld prophezeit habe. Ein Kandidat, der das ganze rechte Drittel plus ein paar Proteststimmen  für sich allein hat, und 4 1/2, die sich um die anderen 2/3 raufen. Was sonst hätte herauskommen sollen?
Dass SPÖVP zu blöd waren, gleich VdB und  Griss zu unterstützen und  unbedingt ihre staubigen Ladenhüter verheizen wollten, ist höhere Blödheit. Sogar der St.Pröllener hat den Braten rechtzeitig gerochen (dabei hätte so ein Khol-Ergebnis seinem aufgeblasenen Ego so gut getan...).",12,0,1.0,0.0,1.0,0.0,0.0,0.0,1.0,0.0,0.0,0,Meinung/Kommentare/FoederlSchmid,Präsidentenwahl: Ein blauer Erdrutschsieg,2016-04-24 17:00:51.000,"Eh logisch. Das Ergebnis ist genau das, was ich mir in meiner Umgebung vorgestellt habe. Ein Kandidat mit dem gesamten rechten Drittel und einigen Proteststimmen wird für sich selbst stimmen, und 4 1/2 werden die anderen 2/3 antreten. Was sollte noch herauskommen?  Es ist höchst dumm, dass die SPÖ ZU dumm war, VDB und Gris zu unterstützen und verzweifelt ihre staubigen Ladenbesitzer aufheizen wollte. Sogar St. Pröllener roch gebraten in der Zeit (so ein Khol-Ergebnis hätte sein geschwollenes Ego so gut gemacht...).",kn
8733,909257,909256.0,10853,17952,2016-04-25 18:47:31.953,online,,"naja, und an einem Freispruch für eines der Krebsgeschwüre der rechtskonservativen Regierungszeit, dem Ex-FP-Politiker Ing. Maischberger, war aber weder rot noch schwarz interessiert, rot aber natürlich am allerwenigsten ...",1,0,0.0,0.0,1.0,0.0,0.0,0.0,1.0,0.0,0.0,0,Newsroom/Wirtschaft/Wirtschaftpolitik,Meischberger-Prozess: Beschwerde gegen Freisprüche,2016-04-25 14:11:41.000," Nun, und Ying Myshberger, ein ehemaliger FP-Politiker, der zu den Krebsarten der rechtskonservativen Regierung gehört, interessierte sich nicht für Rot oder Schwarz, sondern zumindest für Rot...",kn
8736,910989,,10869,28774,2016-04-26 07:17:03.213,online,,">>Bei uns ist nicht alles gut, aber der echte Fehler im System sitzt bei den Roten, hieß es in der ÖVP. Ansonsten gilt: Weitermachen!<<

Also nichts verstanden.",13,1,0.0,0.0,0.0,0.0,0.0,0.0,1.0,0.0,0.0,0,Newsroom/Inland/bundespraesi,Nach der Wahl: Letzte und allerletzte Chancen für die ÖVP,2016-04-25 17:56:10.570," >>Alles ist nicht gut für uns, aber der eigentliche Fehler im System liegt bei den Roten, sagte die ÖVP. Ansonsten weitermachen!<< also nichts verstanden.",kn
8748,921399,921398.0,10953,3935,2016-04-28 21:53:34.493,deleted,,Was Sie verzapfen ist lächerlich.,0,0,0.0,0.0,1.0,0.0,0.0,0.0,1.0,0.0,0.0,0,Newsroom/Inland/Parteien/fp,Nach Anti-FPÖ-Tafel: Blaue Anzeige für Kaffeehausbesitzerin,2016-04-27 14:11:52.000," Es ist lächerlich, dass Sie tippen.",kn
8751,922955,922953.0,10977,2227,2016-04-28 17:04:42.940,online,,"Wo ist da der Vorteil für den Sessel?

Ich sehe das Verhältnis eher als parasitär zulasten des Sitzmöbels (rein biologisch betrachtet, ohne hier werten oder jemanden verunglimpfen zu wollen!).",3,0,0.0,0.0,0.0,1.0,0.0,0.0,1.0,0.0,0.0,0,Newsroom/Inland/Parteien/SPOE,"Faymann sieht ""Befindlichkeitsdebatte""",2016-04-28 13:46:30.000," Wo ist der Vorteil für einen Sessel?    Ich sehe diese Beziehung als Parasiten auf Kosten des Sitzes (rein biologisch gesehen, ohne jemanden hier beurteilen oder erniedrigen zu wollen!).",kn
8760,924682,,11029,9547,2016-04-29 19:15:51.000,deleted,,"Es geht um Diskriminierung- Wenn die Flüchtlinge mehr zahlen müssten, den Shit-Storm würde ich gerne sehen. Aber die Einwohner der Stadt, darf man ja diskriminieren.",0,0,0.0,0.0,0.0,0.0,0.0,0.0,1.0,0.0,0.0,0,Newsroom/Panorama/Flucht,Verbilligte VOR-Tickets für Flüchtlinge eingestellt,2016-04-29 17:32:51.000," Es geht um Diskriminierung - wenn Flüchtlinge mehr zahlen müssen, will ich Einen Shit-Sturm sehen. Aber die Bewohner der Stadt, kann man diskriminieren.",kn
8762,924698,,11029,159,2016-05-01 12:08:17.857,online,,"Mir doch egal, ob du das glaubst...
Aber wieder typisch für die, die ausser sudern und schimpfen nix zusammenbringen.",0,0,0.0,0.0,1.0,1.0,0.0,0.0,1.0,0.0,0.0,0,Newsroom/Panorama/Flucht,Verbilligte VOR-Tickets für Flüchtlinge eingestellt,2016-04-29 17:32:51.000," Es ist mir egal, ob du es glaubst...  Aber wieder aus heiterem Himmel ist es typisch für diejenigen, die spotten und schimpfen, dass nichts zusammengebracht wird.",kn
8769,926234,926233.0,11050,9932,2016-04-30 21:03:58.533,online,1) Wir sind nicht per Du.,"2) Wenn im Duden ""süddeutsch, österreichisch"" steht, bedeutet das: ""eingebürgerter Fehler südlich des Weißwurstäquators"".
3) Wenn man leicht ""genervt"" ist, empfiehlt es sich, keine Postings zu lesen.",5,20,0.0,0.0,1.0,1.0,0.0,0.0,1.0,0.0,0.0,0,Newsroom/Web/Webvermischtes,Warum McLaren teure Sportwägen mit Steinzeit-Laptops wartet,2016-04-30 09:39:53.000,"1) Wir sind nicht von Ihnen. 2) Wenn Duden ""Süddeutsch, Österreichisch"" sagt, bedeutet das: ""Natürlicher Fehler südlich des Weißwurstäquators"".  3) Wenn Sie ein wenig ""irritiert"" sind, wird empfohlen, keine Beiträge zu lesen.",kn
8789,930281,930280.0,11118,30905,2016-05-02 21:32:38.527,online,,"Die Rechtsschreibung hier ist ein einziges die Lämmer.
Ein Skandal Sohn der Gleichen.",6,0,0.0,0.0,0.0,1.0,0.0,1.0,1.0,0.0,0.0,0,Newsroom/Wirtschaft/Wirtschaftpolitik/Energiemarkt,Russland will sein Öl vom Dollar abkoppeln,2016-05-02 18:09:21.000, Hier ist die Schreibweise das gleiche Lamm.  Das ist der Sohn der Schande.,kn
8791,930622,930621.0,11123,22007,2016-05-02 22:12:12.120,online,,"ja, aber für einen ""unwissenden"" war meine antwort ausreichend,
du darfst die neuen fans nicht gleich überfordern :)",2,0,0.0,0.0,0.0,0.0,0.0,0.0,1.0,0.0,0.0,0,Newsroom/Sport/Tennis,Thiem klettert auf Rang 14,2016-05-02 18:27:38.000," Ja, aber meine Antwort auf ""ignorant"" war genug, man sollte nicht sofort neue Fans ertränken :)",kn
8804,935702,935701.0,11187,19109,2016-05-04 17:09:09.400,online,,"Ja, aber mit stärker werdenden arabischen Einfluss, was wiederum der Installation der Scharia hilft.

Dann ist es auch mit den Ampelpärchen vorbei, die vor 1 Jahr(!) montiert wurden :-)",7,0,0.0,0.0,0.0,1.0,0.0,0.0,1.0,0.0,0.0,0,Newsroom/Panorama/Chronik,"Schuldsprüche gegen""Sittenwächter"" der Millennium City",2016-05-04 15:12:05.660," Ja, aber mit zunehmendem arabischen Einfluss wird sie dazu beitragen, die Scharia zu integrieren.    Es ist dann vorbei mit Ampelpaaren, die vor 1 Jahr aufgestellt wurden(!) :-)",kn
8806,938929,,11205,16273,2016-05-05 11:22:20.960,online,"Lebewesen, hier menschliche,","die mit anderen Lebewesen, tierischen und pflanzlichen, umgeht wie sie nach wie vor umgeht, hat nicht nur keinerlei Würde (verdient), sondern auch kein Lebensrecht.
Ist ganz easy.",1,10,0.0,0.0,0.0,0.0,0.0,0.0,1.0,0.0,0.0,0,Newsroom/Panorama/Gesellschaft/PanoramaTiere/Tierethik,"""Eine einzige Bibelstelle zur Norm zu erheben ist Irrweg""",2016-05-05 09:00:00.000,"Lebewesen, hier Menschen, andere Organismen, tierische und pflanzliche, wie es weiterhin geht, haben keine Würde (verdient), sondern auch das Recht zu leben.  Es ist sehr einfach.",kn
8809,939628,939626.0,11220,19572,2016-05-06 08:38:58.890,online,,Ganz meine Meinung! ... der Gestank war fürchterlich ... dazu ein durchschnittliches / langweiliges Angebot zu hohen Preisen ... schlecht organisierte Garderobe ... und dafür wird noch Eintritt verlangt ...,2,0,1.0,0.0,0.0,0.0,0.0,0.0,1.0,0.0,0.0,0,Livingroom/Lifestyle/EssenTrinken,"Würstel vom Truck, Schüttelbrot im Park",2016-05-06 05:30:00.000, Ganz meine Meinung! ... Der Gestank war schrecklich ... Darüber hinaus durchschnittliches/langweiliges Angebot zu höheren Preisen ... Schlecht organisierte Garderobe ... Und dies erfordert immer noch Zugang ...,kn
8816,942203,,11258,7439,2016-05-07 13:17:10.857,deleted,,"""Doch ein Einreisezertifikat sei von der kenianischen Botschaft nicht ausgestellt worden.""

Botschaft sofort schliessen.

Die ist Mitschuld am Mord und hat ihr Recht hier zu sein verwirkt.

Wieso toleriert Österreich Botschaften die Gangster schicken?",0,0,0.0,0.0,0.0,0.0,0.0,0.0,1.0,0.0,0.0,0,Newsroom/Panorama/Chronik/kriminalitaet,Gefährlichkeit des Eisenstangen-Angreifers war bekannt,2016-05-06 18:04:55.000," ""Allerdings wurde von der kenianischen Botschaft keine Einreisebescheinigung ausgestellt.""    Schließen Sie die Nachricht sofort.    Sie ist in den Mord verwickelt und hat ihr Recht, hier zu sein, verloren.    Warum toleriert Österreich das Versenden von Räubern?",kn
8820,942393,942392.0,11265,19037,2016-05-07 19:55:16.803,online,,"Gut, herabwürdigung religiöser Lehren.

Was aber, wenn jemand - wie in der Südsee - einen Schweinekopf als das höchste und wertvollste empfidet, ein Zeichen der Wertschätzung? Das Gericht könnte genausogut diese Ansicht vertreten und den Schweinekopf als Kompliment sehen.

Also übernimmt ein österreichisches Gericht die Ansicht einer bestimmten Religionsgemeinschaft, und diese ist nicht aus der Südsee.",1,6,0.0,0.0,0.0,0.0,0.0,0.0,1.0,0.0,0.0,0,Newsroom/Panorama/Chronik,Schweineköpfe vor Moschee in Graz: Verdächtiger gefasst,2016-05-06 10:06:54.000," Gute, erniedrigende religiöse Lehren.    Aber was, wenn jemand den Kopf eines Schweins als das höchste und wertvollste Symbol der Wertschätzung wahrnimmt, wie in der Südsee? Das Gericht kann diese Ansicht vertreten und den Schweinekopf als Kompliment sehen.    Das österreichische Gericht vertritt daher die Auffassung einer bestimmten Religionsgemeinschaft, und das ist nicht von der Südsee.",kn
8831,949976,949974.0,11332,7386,2016-05-09 20:11:14.037,online,,"Was schreiben Sie da?? Belgien hat einen Muslimenanteil von nicht einmal 4%!!
Informieren Sie sich, bevor Sie so einen Stuss posten.",8,2,1.0,0.0,1.0,0.0,0.0,0.0,1.0,0.0,0.0,0,Newsroom/International/Europa/Belgien,"Belgien: IS-Terrorist gestand Enthauptung, bleibt aber auf freiem Fuß",2016-05-09 18:50:46.000," Was schreiben Sie?? Belgien hat einen muslimischen Anteil von weniger als 4%!!  Prüfen Sie, bevor Sie einen solchen Stolperstein posten.",kn
8849,956972,956970.0,11448,19368,2016-05-12 16:05:41.460,online,"Ad 2. Prinzipiell Fälle, wo sich die Linken exponiert haben und zu weit gegangen sind","Tier""schützer""? - eher Sachbeschädiger und Geschäftsstörer, 
der Puber ist sowieso ein verrückter Schmierfink, mit Kunst oder Kreativität hat das nichts zu tun, Ist genauso kreativ wie ein Hund der an einen baum pinkelt um zu markieren.
Der Josef S. war meines Wissens nach der Mistkübelwerfer",0,0,0.0,0.0,1.0,0.0,0.0,0.0,1.0,0.0,0.0,0,Newsroom/Inland/Sachpolitik/sicherheit,Sobotka will strengere Regeln gegen Kriminalität,2016-05-12 11:14:11.520,"Anzeige 2. Hat sich die Linke unter philosophischen Umständen entblößt und tierisch ""Beschützer"" zu weit gegangen? - Schäden und Betriebsstörungen, der Tumor irgendwie verrückt Glättefink, mit Kunst oder Kreativität hat es nichts zu tun, kreativ wie ein Hund pinkeln auf einem Baum zu identifizieren.  Joseph S. Soweit ich weiß, nach dem Schrott-Eimerwerfer",kn
8866,965487,,11566,16251,2016-05-16 14:45:09.153,online,,Soviel Zynismus in so wenigen Worten ist auch eine Kunst!,2,1,0.0,0.0,0.0,0.0,0.0,0.0,1.0,0.0,0.0,0,Newsroom/Etat/TV/tvtagebuch,Das grinsende Gesicht der FPÖ,2016-05-16 09:46:07.000, So viel Zynismus ist eine Kunst in wenigen Worten!,kn
8869,966728,966710.0,11580,26264,2016-05-18 10:02:54.727,deleted,"Ich glaube nicht das Sie es gelesen haben, wenn Sie die Anzahl nicht mal finden können",,1,0,0.0,0.0,0.0,1.0,0.0,0.0,1.0,0.0,0.0,0,Newsroom/International/Nahost/Israel,"Netanjahus ""Frust"" über die Europäische Union",2016-05-16 17:43:28.000,"Ich glaube nicht, dass Sie es lesen, wenn Sie die Nummer nicht finden können ",kn
8884,974913,,11667,2344,2016-05-19 11:50:13.143,online,,"""In Wahrheit finanzieren Menschen ohne österreichische Staatsbürgerschaft die Pensionen"".
Mit den 1,6 Millarden (- den nicht berechneten Kosten für Asylwerber)
Diese Aussage ist leider auch reine Propaganda. Außerdem zahlen viele Ausländer ein, werden dann später ÖsterreicherInnen und bekommen dann raus (Pension). Umgekehrt geht das nicht.",22,0,1.0,0.0,0.0,0.0,0.0,0.0,1.0,0.0,0.0,0,Newsroom/Inland/Sachpolitik/Sozialpolitik,"Ausländer zahlen mehr ins Sozialsystem ein, als sie erhalten",2016-05-19 06:00:00.000," ""Die Wahrheit ist, dass Menschen ohne österreichische Staatsbürgerschaft ihre Pensionen finanzieren.""  1,6 Milliarden (- Nicht berücksichtigte Ausgaben für Asylsuchende) Diese Aussage ist leider reine Werbung. Außerdem zahlen viele Ausländer, werden dann Österreicher und gehen dann (Rente). Im Gegenteil, das ist nicht möglich.",kn
8888,976050,,11689,7440,2016-05-19 16:51:01.310,online,new deal,Versorgungsposterl für Fischer und Faymann schaffen.....,4,16,0.0,0.0,0.0,1.0,0.0,0.0,1.0,0.0,0.0,0,Newsroom/Inland/Parlament,"Kern startet seinen ""Countdown um die Herzen in diesem Land""",2016-05-19 14:04:56.000,Erstellen Sie ein neues Deal Lieferplakat und Fayman für Fischer.....,kn
8897,977071,,11700,13459,2016-05-20 01:21:19.900,online,Weihbischof Blaun?,,7,1,0.0,0.0,1.0,0.0,0.0,0.0,1.0,0.0,0.0,0,Newsroom/Inland/Sachpolitik/ipokirche,Salzburgs Weihbischof Laun empfiehlt Hofer,2016-05-19 14:23:06.000,Weihbischof Blaine? ,kn
8901,977416,977409.0,11707,31034,2016-05-20 15:47:31.697,online,,"Da stimme ich vollkommen zu. Aber wo ist der Aufschrei gegen gegen integrationsunwillige Flüchtlinge oder gegen Linksextremismus ?
Für mich ist VdB ist genaus links, wie Hofer rechts ist.
Wieso soll linker Extremismus um soviel besser sein als rechter ?
Soll nicht heissen, dass ich Hofer bevorziehen würde. Soll heissen, dass ich keinem von beiden Kandidaten vertraue, und es mir vorkommt, ich hätte die Wahl zwischen Pech und Schwefel.",5,1,1.0,0.0,0.0,0.0,0.0,0.0,1.0,0.0,0.0,0,Newsroom/User/Userkommentare,Da Hofa woas!,2016-05-19 17:23:41.000," Dem stimme ich voll und ganz zu. Doch wo ist der Aufschrei gegen Flüchtlinge, die sich nicht integrieren oder gegen Linksextremismus wehren wollen?  Für mich ist der VDB genau links, wie Hofer auf der rechten Seite war.  Warum sollte Linksextremismus besser sein als Rechtsextremismus?  Sagen Sie nicht, dass ich einen Hofer bevorzuge. Ich sage, ich vertraue keinem Kandidaten, und es scheint mir, dass ich die Wahl zwischen Pech und Schwefel habe.",kn
8906,978135,978132.0,11720,25421,2016-05-20 16:37:14.480,deleted,Alukappe aufsetzen ...,... dann werden sie sich gleich besser fühlen. Versprochen.,3,1,0.0,0.0,1.0,1.0,0.0,0.0,1.0,0.0,0.0,0,Newsroom/Panorama/Weltchronik/Flugkatastrophen,Egypt Air: Französische Luftfahrtbehörde bestätigt Rauchalarm,2016-05-20 06:24:42.110,Tragen einer Aluminiumkappe ... Dann werden sie besser sein. Versprochen.,kn
8918,981180,981179.0,11758,18918,2016-05-21 18:43:30.193,online,copy and paste. so kennen wir euch.,,1,1,0.0,0.0,1.0,1.0,0.0,0.0,1.0,0.0,0.0,0,Newsroom/Inland/bundespraesi/Wahlkampfreportagen,"Norbert Hofer, das Chamäleon",2016-05-20 21:01:04.320,Kopieren und Einfügen. Woher kennen wir Sie? ,kn
8938,990824,990823.0,11882,3753,2016-05-25 23:02:34.383,online,passt ins Bild. Von mir haben sie,"mehrere Postings mit vielen Stricherln (rot und grün gleichviel) gelöscht, nur weil ich geschrieben habe, dass mich Kern an einen Zwetschkenkrampus erinnert. War nicht mal negativ gemeint - bloss als äußerliches Faktum.",4,2,0.0,0.0,0.0,1.0,0.0,1.0,1.0,0.0,0.0,0,Newsroom/Inland,Kern will rasche Arbeitserlaubnis für Asylwerber,2016-05-24 19:07:32.000,"Passt ins Bild. Er löschte mehrere Postings von mir mit vielen Ausschlägen (rote und grüne Äquivalente), weil ich schrieb, dass The Horn mich an Pflaumenkrämpfe erinnert. Nicht einmal negativ verstanden - wie es bei äußeren Tatsachen der Fall war.",kn
8940,990831,990830.0,11883,6395,2016-05-25 16:35:39.053,online,,"Ich wäre an einem guten Nebenverdienst nicht uninteressiert. Da Sie binnen weniger Tage schon ein paar hundert Postings geschrieben haben, und zwar mit eindeutiger Tendenz, meine Frage an Sie: Wieviel bezahlt die FPÖ für Kampfpostings?",19,2,0.0,0.0,1.0,1.0,0.0,0.0,1.0,0.0,0.0,0,Newsroom/Inland/bundespraesi/ErgebnisseBP,Wahlkarten: Unregelmäßigkeiten in vier Kärntner und einem steirischen Bezirk angezeigt,2016-05-25 11:24:05.070," Ich interessiere mich nicht für gute Nebengehälter. Da Sie in wenigen Tagen bereits ein paar hundert Postings mit klarem Instinkt geschrieben haben, lautet meine Frage an Sie: Wie viel zahlt die FPÖ für Kriegspostings?",kn
8943,991168,,11892,28609,2016-05-25 22:15:02.737,online,"Verteidiger Wolfgang Blaschitz hatte auf den nun ordentlichen Lebenswandel seines Mandanten, der im Juni zum zweiten Mal Vater wird, verwiesen","Und dann zum dritten, vierten, fünften ... Mal.",5,2,0.0,1.0,0.0,0.0,0.0,0.0,1.0,0.0,0.0,0,Newsroom/Panorama/Chronik,Teilbedingte Haft für mutmaßlichen Syrien-Kämpfer in Krems,2016-05-25 18:27:16.000,"Verteidiger Wolfgang Blasthitz hatte den inzwischen geordneten Lebensstil seines Mandanten erwähnt, der im Juni zum zweiten Mal Vater wird, und dann zum dritten, vierten, fünften... B.",kn
8949,993808,,11917,3509,2016-05-26 18:09:49.217,deleted,wtf?,"was ist mit schampoo oder seife? also hygieneprodukte die männer UND frauen verwenden? Was ist mit ESSEN? männer UND frauen müssen essen? bevor sie steuer auf essen abschaffen (überlebenswichtig) schaffen sie steuer auf tampons ab? ""Ein Sieg für Frauen"" -> genauso ist es, und zwar ein sieg im kampf: Frauen besser zustellen als andere Menschen. Wieso muss ich für meine Seife oder Schampoo steuer zahlen? (geschweigedenn für mein Essen)",0,0,1.0,0.0,0.0,0.0,0.0,0.0,1.0,0.0,0.0,0,dieStandard/diePolitik,Auch New York kippt Tampon-Steuer,2016-05-26 15:12:49.000,"Wtf? Was ist mit Shampoo oder Seife? Also Hygieneprodukte, die von Männern und Frauen verwendet werden? Was ist mit Essen? Sollten Männer und Frauen essen? Werden sie die Tamponsteuer aufheben, bevor sie (haupt) die Steuer auf Lebensmittel aufheben? ""Sieg der Frauen"" - > es ist dasselbe, und es ist ein Sieg im Kampf: Frauen besser zu liefern als andere Menschen. Warum sollte ich Steuern auf meine Seife oder mein Shampoo zahlen? (Verlassen Sie meine Nahrung)",kn
8961,1000667,1000666.0,11996,6476,2016-05-29 23:03:40.497,online,,"Microsoft wird immer am längeren Ast sitzen, solange man Windows verwendet.",3,1,1.0,0.0,0.0,0.0,0.0,0.0,1.0,0.0,0.0,0,Newsroom/Web/Innovationen/Microsoft,Windows-10-Upgrade: Fenster schließen wird als Zustimmung gewertet,2016-05-29 13:52:36.000," Maptayet wird immer in einem langen Zweig sitzen, bis Sie Windows verwenden.",kn
8971,1006462,1006461.0,12059,20199,2016-05-31 12:07:38.587,online,"wien verschreckt investoren, wenn sie trotz politischer zusagen ihr geld in sand setzen.","wahrscheinlich läuft es auf schmiergeldzahlungen hinaus. was für ein armutszeugnis.
da ändert Ihr neid auf die reichen auch nichts dran.",0,0,0.0,0.0,0.0,0.0,0.0,0.0,1.0,0.0,0.0,0,Newsroom/Panorama/wien,"Vassilakou: ""Geldgier ist der größte Feind von Kulturstätten""",2016-05-31 07:49:41.000,"Wein erschreckt Investoren, wenn sie ihr Geld trotz politischer Versprechungen in den Sand stecken. Dies entspricht wahrscheinlich Schmiergeldzahlungen. Was für ein Armutszeugnis.  Auch ihre Eifersucht auf die Reichen ändert nichts.",kn
3247,6015,6014.0,94,28638,2015-06-02 14:21:36.867,online,,"Weil es dein meisten Leuten verständlicherweise vollkommen egal ist, was die Gesellschaft oder jede andere dahergelaufene Diskursgruppe von ihnen hält.",2,0,0.0,0.0,1.0,0.0,0.0,0.0,1.0,0.0,0.0,0,Newsroom/Web/Games/Berufsspieler,"Sexistischer Shitstorm gegen ""Fifa 16"": Ein Eigentor für die Spieler",2015-06-02 11:11:03.000," Weil die meisten Menschen nicht verstehen, was die Gesellschaft oder andere Diskurse denken.",fil
3285,9724,9721.0,140,9920,2015-06-03 12:20:29.250,online,,"Gabalier?
Künstler?
Bruahahaha!",5,1,0.0,0.0,1.0,1.0,0.0,0.0,1.0,0.0,0.0,0,Meinung/Kommentare/Sulzbacher,Festplattenabgabe: Gabalier bekommt nun Geld für Urlaubsfotos,2015-06-03 09:47:45.000, Gabalier?  Künstler?  Bruaha!,fil
3384,13076,,164,12465,2015-06-04 07:44:08.280,online,Es sind immer dieselben bigotten verlogenen Berufsheilige,"die mit ihren eigenen sexuellen - mitunter kranken und unmoralischen - Phantasien nicht zurecht kommen und genau aus diesem Grund alles was anders ist verteufeln. 

Peinlich und nicht zeitgemäß",4,5,1.0,0.0,1.0,0.0,0.0,0.0,1.0,0.0,0.0,0,Newsroom/International/Europa/deutschland,Homophobie: Empörung über Regierungschefin des Saarlandes,2015-06-03 18:27:52.000,"Sie sind immer beide bioted Berufsheiligen, die mit ihrer eigenen sexuellen - manchmal kranken und unmoralischen - Fantasienicht nicht zurechtkommen und aus diesem bestimmten Grund alles anders zeigen.     Comgoing und veraltet",fil
3465,18390,,285,29361,2015-06-07 22:28:16.003,online,so ein psycho,,0,0,0.0,0.0,1.0,0.0,0.0,0.0,1.0,0.0,0.0,0,Newsroom/Panorama/wien,"Schuldspruch gegen Wiener Anwalt, der Neunjähriger den Arm brach",2015-06-02 13:38:43.000,So ein Psycho ,fil
3472,18881,18879.0,296,144,2015-06-08 11:04:57.817,online,,leider hat keine Band so schwer abgebaut wie Manowar seit der Triumph. Mittlerweile könntens schon zusammen mitn Gabalier auftreten :(,2,0,0.0,0.0,0.0,1.0,0.0,0.0,1.0,0.0,0.0,0,Newsroom/Kultur/Musikkultur/Musikfestival,Metallica: Streichkäse am Jeansgilet,2015-06-05 10:59:59.000, Leider ist seit dem Sieg kein Team als Manowar an den Rand gedrängt. Inzwischen kann der Gabalier :(,fil
3481,19412,19404.0,313,15214,2015-06-08 17:40:24.630,deleted,in Gladbeck (D) ruft der per Lautsprecher 3 mal am Tag !!,,0,0,0.0,0.0,0.0,1.0,0.0,0.0,1.0,0.0,0.0,0,Newsroom/Panorama/Chronik/gerichtsreportagen,Terrorprozess: Der seitenspringende Chauffeur,2015-06-08 12:59:16.390,in Gladbeck (D) ruft der Lautsprecher 3 mal am Tag !! ,fil
3516,23038,23037.0,368,26167,2015-06-09 23:50:39.673,online,,"Ja, der sollte sich mal den Film Der Untergang reinziehen. :)",3,0,0.0,0.0,0.0,1.0,0.0,0.0,1.0,0.0,0.0,0,Newsroom/International/Europa/ukraine,Neue Kämpfe in der Ukraine: Feuer an allen Fronten,2015-06-09 17:49:33.980," Ja, er sollte den Film The Fall machen. :)",fil
3547,25320,,402,1441,2015-06-10 14:57:09.987,online,,"Und weiter geht's mit dem Kasperltheater ...........

http://diepresse.com/home/politik/innenpolitik/kulisse/4751313/Vier-neue-Kopfe-fur-OVP-Wenn-sie-wollen-durfen-sie",0,0,0.0,0.0,0.0,0.0,0.0,0.0,1.0,0.0,0.0,0,Newsroom/Inland/Parlament/Nationalrat,Ex-Stronach-Mandatare: Kreuzweise Mitarbeiter-Anstellung war legal,2015-06-09 13:08:22.070, Und wir gingen ins Kasperltheater ........    http://diepresse.com/home/politik/innenpolitik/kulisse/4751313/Vier-neue-Kopfe-fur-OVP-Wenn-sie-wollen-durfen-sie,fil
3626,27821,27820.0,447,3112,2015-06-11 18:08:32.163,deleted,,"erstens ist die Zahl erfunden, und selbst wenn..., wenn deren kultureller Hintergrund der ""anatolische Islam"" gewesen wäre, dann wärs nix mit Gleichberechtigung zw. Mann und Frau, nix mit Life Ball, Conchita Wurst usw. ums mal so zu formulieren",5,1,0.0,1.0,0.0,0.0,0.0,0.0,1.0,0.0,0.0,0,Newsroom/Panorama/Gesellschaft/demografischerwandel,Österreichs Bevölkerung wuchs im Vorjahr um 77.000 Menschen,2015-06-11 13:01:46.000," erstens ist die Zahl erfindungsgemäß, und sogar ... wenn ihr kultureller Hintergrund ""Anatolian Erden"" ist, dann gibt es keine Gleichheit zwischen Mann und Frau, nichts auf Life Ball, Conchita Wurst usw.",fil
